SYMBOL,DESCRIPTION
DYNS,DYNAMIC SPL PURP CORP CL A (DE
DYNT,DYNATRONICS CORP
DZSI,DZS INC COM
DZZ,DB AG LONDON BRH
E,ENI SPA ADS (EC REPTG 2 ORD SH
EA,ELECTRONIC ARTS INC
EAATF,EARTHWORKS INDUSTRIES INC (F) 
EACO,EACO CORP COM STK (FL)
EACPU,EDIFY ACQUISITION CORP UNIT 1 
EAD,WELLS FARGO INCOME OPPORTUNITI
EADSY,AIRBUS SE AMERICAN DEPOSITARY 
EAF,GRAFTECH INTL LTD COM
EAGG,ISHARES ESG AWARE U.S. AGGREGA
EAI,ENTERGY ARK LLC 1ST MTG BD 4.8
EAOA,ISHARES ESG AWARE AGGRESSIVE A
EAOM,ISHARES ESG AWARE MODERATE ALL
EAOR,ISHARES ESG AWARE GROWTH ALLOC
EAR,EARGO INC COM (DE)
EARN,ELLINGTON RESIDENTIAL MORTGAGE
EARS,AURIS MED HLDG LTD SHS (BMU)PA
EASG,DBX ETF TR XTRACKERS MSCI EAFE
EAST,EASTSIDE DISTILLING INC COM PA
EAT,BRINKER INTL INC
EATBF,EAT BEYOND GLOBAL HLDGS INC
EAWD,ENERGY & WTR DEV COR
EB,EVENTBRITE INC COM CL A (DE)
EBAC,EUROPEAN BIOTECH ACQUISITION C
EBACW,EUROPEAN BIOTECH ACQUISITION C
EBAY,EBAY INC
EBET,ESPORTS TECHNOLOGIES INC COM (
EBF,ENNIS INC COM
EBIX,EBIX INC
EBIZ,GLOBAL X FDS E-COMM ETF (DE)
EBKDY,Erste Group Bank AG Sponsored 
EBLU,ECOFIN GLOBAL WATER ESG FUND
EBMT,EAGLE BANCORP MONTANA INC COM 
EBND,SPDR BLOOMBERG BARCLAYS EMERGI
EBON,EBANG INTL HLDGS INC
EBR,ELECTROBRAS CENTRAIS ADR (COM)
EBRB,ELETROBRAS CENTRAIS ADR (PRF) 
EC,ECOPETROL S A SPONSORED ADS (C
ECC,EAGLE PT CR CO LLC COM STK (DE
ECCC,EAGLE PT CR CO INC TERM PFD ST
ECCE,EAGLE FORD OIL & GAS CORP COM 
ECCW,EAGLE PT CR CO INC NT 03/25/21
ECCX,EAGLE PT CR CO INC NT 6.687% D
ECDD,ECRID INC
ECF,ELLSWORTH GROWTH & INCOME FD
ECH,ISHARES INC MCSI CHILE ETF
ECHO,ECHO GLOBAL LOGISTICS INC COM 
ECIFY,Electricite de France SA Unspo
ECL,ECOLAB INC
ECLN,FIRST TR EXCHANGE-TRADED FD IV
ECNS,ISHARES MSCI CHINA SMALL CAP E
ECOLW,US ECOLOGY PARENT INC WT EXP 1
ECOM,CHANNELADVISOR CORP
ECON,COLUMBIA ETF TR II COLUMBIA EM
ECOR,ELECTROCORE INC COM (DE)
ECOW,PACER FDS TR EMERGING MARKETS 
ECOX,ECO INNOVATION GROUP INC COM
ECOZ,TRUESHARES ESG ACTIVE OPPORTUN
ECPG,ENCORE CAPITAL GROUP INC
ECSL,ECARE SOLUTIONS INC
ECTM,ECA MARCELLUS TRUST I COM UNIT
ED,CONSOLIDATED ED INC(HOLDING CO
EDAP,EDAP TMS S.A. SPONS ADR
EDC,DIREXION DAILY EMERGING MARKET
EDD,MORGAN STANLEY EMERGING MKTS D
EDDYF,EDISON COBALT CORP (CANADA)
EDEN,ISHARES TR MSCI DENMARK ETF
EDF,STONE HBR EMERGING MKTS INCOME
EDI,STONE HBR EMERGING MKTS TOTAL 
EDIT,EDITAS MEDICINE INC COM STK (D
EDIV,SPDR S&P EMERGING DIVIDENDS ET
EDNMY,EDENRED S A UNSPONSORED ADR (F
EDOC,GLOBAL X FDS TELEMEDICINE & DI
EDOG,ALPS ETF EMERGING SECTOR DIVI 
EDOW,FIRST TR EXCHANGE TRADED FD
EDPFY,EDP-ELECT DE PORTUGAL S A (REP
EDR,ENDEAVOR GROUP HLDGS INC CL A 
EDRY,EURODRY LTD
EDTK,SKILLFUL CRAFTSMAN ED TECH LTD
EDTX,EDTECHX HLDGS ACQUISITION CORP
EDTXF,SPECTRAL MED INC COM (CANADA) 
EDTXW,EDTECHX HLDGS ACQUISITION CORP
EDU,NEW ORIENTAL EDUCATION & TECH 
EDUC,EDL DEVELOPMENT CORP DEL
EDUT,GLOBAL X FDS EDUCATION ETF
EDV,VANGUARD EXTENDED DURATION TRE
EDXC,ENDEXX CORPORATION
EDZ,DIREXION DAILY EMERGING MARKET
EEA,THE EUROPEAN EQUITY FUND INC. 
EEFT,EURONET WORLDWIDE INC
EEIQ,ELITE ED GROUP INTL LTD USD CO
EELV,INVESCO ETF TR II S&P EMERGING
EEM,ISHARES MSCI EMERGING MARKETS 
EEMA,ISHARES MSCI EMERGING MARKETS 
EEMD,ETF SER SOLUTIONSAAM S&P EMERG
EEMMF,E3 METALS CORP COM(CAN)
EEMS,ISHARES MSCI EMERGING MKTS SMA
EEMV,ISHARES MSCI EMERGING MARKETS 
EEMX,SPDR IDX SHS FDS MSCI EMERGING
EES,WISDOMTREE U.S. SMALLCAP FUND 
EET,PROSHARES TR ULTRA MSCI EMERGI
EEV,PROSHARES TR ULTRASHORT MSCI E
EEVVF,EVE & CO INC (CANADA)
EEX,EMERALD HLDG INC COM (DE)
EFA,ISHARES TR MSCI EAFE ETF
EFAD,PROSHARES TR PROSHARES MSCI EA
EFAS,GLOBAL X FDS MSCI SUPERDIVIDEN
EFAV,ISHARES MSCI EAFE MIN VOL FACT
EFAX,SPDR INDEX SHS FDS MSCI EAFE F
EFC,ELLINGTON FINL INC COM
EFCPRA,ELLINGTON FINL INC CUM PFD SER
EFG,MSCI EAFE GROWTH ETF
EFIV,SPDR SER TR SPDR S&P 500 ESG E
EFIX,FIRST TR EXCHANGE TRADED FD VI
EFL,EATON VANCE FLOATING RATE 2022
EFO,PROSHARES TRUST ULTRA MSCI EAF
EFOI,"ENERGY FOCUS, INC. COM PAR"
EFR,EATON VANCE SR FLTG RATE FUND 
EFSC,ENTERPRISE FINANCIAL SERVICES 
EFSH,1847 HLDGS LLC
EFT,EATON VANCE FLOATING RATE INCO
EFU,PROSHARES ULTRASHORT MSCI EAFE
EFV,MSCI EAFE VALUE ETF
EFX,EQUIFAX INCORPORATED
EFZ,PROSHARES SHORT MSCI EAFE
EGAN,EGAIN CORPORATION COM STK (DE)
EGBN,EAGLE BANCORP INC (MD)
EGDD,"Eastern Goldfields, Inc. Commo"
EGF,BLACKROCK ENHANCED GOVT FUND I
EGHT,8X8 INC-NEW
EGIEY,ENGIE BRASIL ENERGIA S A ADR S
EGIS,2ND VOTE FDS 2ND VOTE SOCIETY 
EGLE,EAGLE BULK SHIPPING INC SHS NE
EGLX,ENTHUSIAST GAMING HLDGS INC NE
EGMCF,EMGOLD MNG CORP (CANADA)
EGO,ELDORADO GOLD CORP NEW COM NEW
EGP,EASTGROUP PROPERTIES INC
EGRX,EAGLE PHARMACEUTICALS INC (DE)
EGY,VAALCO ENERGY INC (NEW)
EH,EHANG HLDGS LTD ADS REPSTG CL 
EHC,ENCOMPASS HEALTH CORP COM (DE)
EHI,WESTERN ASSET GLB HIGH INCM FD
EHT,EATON VANCE 2021 TARGET TERM T
EHTH,"EHEALTH, INC. COM STK"
EHVVF,EHAVE INC COM NEW (CANADA)
EIC,EAGLE PT INCOME CO INC COM (DE
EIDO,ISHARES TR MSCI INDONESIA ETF 
EIG,EMPLOYERS HOLDINGS INC COM (NV
EIGR,EIGER BIOPHARMACEUTICALS INC C
EIM,EATON VANCE
EINC,VANECK VECTORS ETF TR VANECK V
EIS,ISHARES INC MCSI ISRAEL ETF
EIX,EDISON INTERNATIONAL
EJAN,INNOVATOR ETFS TR MSCI EMERG M
EJFAW,EJF ACQUISITION CORP WT EXP (C
EJH,E-HOME HOUSEHOLD SVC HLDGS LTD
EJMLL,FANTEX INC
EJPRY,East Japan Railway Co Unsponso
EJUL,INNOVATOR ETFS TR MSCI EMERGIN
EKTAY,ELEKTA B SHS UNSPONSORED ADR R
EL,ESTEE LAUDER CO'S INC CL-A
ELA,ENVELA CORP COM (NV)
ELAN,ELANCO ANIMAL HEALTH INC COM (
ELAT,ELANCO ANIMAL HEALTH INC
ELBSF,ENGAGEMENT LABS INC COM NEW(CA
ELC,ENTERGY LA LLC COLLATERAL TR M
ELD,WISDOMTREE EMERGING LOCAL DEBT
ELDN,ELEDON PHARMACEUTICALS INC
ELEMF,ELEMENTAL ROYALTIES CORP
ELEV,ELEVATION ONCOLOGY INC
ELEZY,ENDESA S A UNSPONSORED ADR (ES
ELF,E L F BEAUTY INC COM (DE)
ELFIF,EL FINANCIAL CORP LTD (F)
ELGXQ,ENDOLOGIX INC (DE)
ELLO,ELLOMAY CAPITAL LTD ORDINARY S
ELMD,ELECTROMED INC COM
ELMS,ELECTRIC LAST MILE SOLUTIONS I
ELMSW,ELECTRIC LAST MILE SOLUTIONS I
ELOX,ELOXX PHARMACEUTICALS INC
ELP,COMPANHIA PARANAENSE DE ENERGI
ELRA,ELRAY RES INC COM
ELRFF,EASTERN PLATINUM LIMITED NEW O
ELRRF,ELORO RESOURCES LTD ORDINARY S
ELS,"EQUITY LIFESTYLE PROPERTIES, I"
ELSE,ELECTRO-SENSORS INC
ELTK,ELTEK LTD PETACH TIKVA ISRAEL 
ELTP,ELITE PHARMACEUTICAL
ELUXY,AKTIEB. ELECTROLUX B ADR SPNSD
ELVT,ELEVATE CREDIT INC COM
ELY,CALLAWAY GOLF CO
ELYGF,ELY GOLD ROYALTIES I (CANADA) 
ELYS,"ELYS GAME TECHNOLOGY, CORP COM"
EM,SMART SH GLOBAL LTD ADR (CYM) 
EMAG,VANECK VECTORS ETF TR EMERGING
EMAN,EMAGIN CORPORATION NEW
EMB,ISHARES TR
EMBD,GLOBAL X FDS EMERGING MKTS BD 
EMCB,WISDOMTREE EMERGING MRKTS CORP
EMCF,EMCLAIRE FINL CORP
EMD,WESTERN ASSET EMERGING MKTS DE
EMDV,PROSHARES TR MSCI EMERGING MKT
EME,EMCOR GROUP INC
EMED,ELECTROMEDICAL TECHNOLOGIES IN
EMF,TEMPLETON EMERGING MKT FUND
EMFM,GLOBAL X MSCI NEXT EMERGING & 
EMGF,ISHARES MSCI EMERGING MARKETS 
EMHC,SPDR SER TR BLOOMBERG BARCLAYS
EMHTF,EMERALD HEALTH THERAPEUTICS IN
EMHY,ISHARES J.P. MORGAN EM HIGH YI
EMIF,ISHARES EMERGING MARKETS INFRA
EMKR,EMCORE CORP
EML,EASTERN CO
EMLAF,EMPIRE LTD CL-A (F)
EMLC,VANECK VECTORS ETF TR J.P. MOR
EMLP,FIRST TR EXCHANGE-TRADED IV
EMMA,EMMAUS LIFE SCIENCES INC NEW C
EMMS,EMMIS COMMUNICATIONS CRP NEW C
EMN,EASTMAN CHEMICAL CO
EMNT,PIMCO ETF TR ENHANCED SHORT MA
EMO,CLEARBRIDGE ENERGY MIDSTREAM O
EMOTF,EMERITA RES CORP COM NEW(CANAD
EMP,ENTERGY MISS LLC 1ST MTG BND 4
EMPR,EMPIRE PETROLEUM CORPORATION. 
EMPW,EMPOWER LTD ORD SHS CL A USD
EMPWU,EMPOWER LTD UNITS USD:ONE CL &
EMPWWS,EMPOWER LTD WT EXP USD 11/30/2
EMPYF,EMPRESS RTY CORP (CANADA)
EMQQ,EMQQ EMERGING MARKETS INTERNET
EMR,EMERSON ELECTRIC CO
EMRAF,EMERA INCORPORATED
EMSG,DBX ETF TR XTRACKERS MSCI EMER
EMTL,SPDR DOUBLELINE EMERGING MARKE
EMTY,PROSHARES TR DECLINE OF THE RE
EMX,EMX RTY CORP COM (CAN)
EMXC,ISHARES INC MSCI EMERGING MKTS
EMXF,ISHARES ESG ADVANCED MSCI EM E
ENAB,"ENABLE HOLDINGS, INC (DE)"
ENB,ENBRIDGE INC
ENBA,ENBRIDGE INC SUB NT FIXED/FLTG
ENBL,ENABLE MIDSTREAM PARTNERS LP C
ENDMF,ENDURO METALS CORP COM (CAN)
ENDO,ENDOCAN CORPORATION COMMON STO
ENDP,ENDO INTL PLC ORD SHS (IRL)
ENDTF,CANOE EIT INCOME FUND UNITS (C
ENDV,ENDONOVO THERAPEUTICS INC
ENFA,890 5TH AVE PARTNERS INC CL A 
ENFAW,890 5TH AVE PARTNERS INC RED W
ENFR,ALERIAN ENERGY INFRASTRUCTURE 
ENG,ENGLOBAL CORP
ENGGY,Enagas sa Unsponsored ADR (Spa
ENGIY,ENGIE (FRANCE)
ENIA,ENEL AMERICAS S A SPONSORED AD
ENIC,ENEL CHILE S A SPONSORED ADR
ENJ,ENTERGY NEW ORLEANS LLC 1ST MT
ENKS,ENERKON SOLAR INTL INC COM
ENLAY,Enel Societa Per Azioni Unspon
ENLC,ENLINK MIDSTREAM LLC COM UIT R
ENLV,ENLIVEX THERAPEUTICS LTD COM O
ENNV,ECP ENVIRONMENTAL GROWTH OPPOR
ENNVW,ECP ENVIRONMENTAL GROWTH
ENO,ENTERGY NEW ORLEANS LLC 1ST MT
ENOB,ENOCHIAN BIOSCIENCES INC
ENOR,ISHARES TR MSCI NORWAY ETF
ENPC,EXECUTIVE NETWORK PARTNERING
ENPCWS,EXECUTIVE NETWORK PARTNERING
ENPH,"ENPHASE ENERGY, INC COM STK"
ENR,ENERGIZER HLDGS INC COM NEW
ENRPRA,ENERGIZER HLDGS INC NEW MANDAT
ENS,ENERSYS COM STK
ENSC,"ENSYSCE BIOSCIENCES, INC. COMM"
ENSCW,ENSYSCE BIOSCIENCES
ENSG,ENSIGN GROUP INC COM STK (DE) 
ENSV,ENSERVCO CORPORATION COMMON ST
ENTA,ENANTA PHARMACEUTICALS INC COM
ENTEF,ESE ENTMT INC (CANADA)
ENTG,ENTEGRIS INC
ENTR,ENTREPRENEURSHARES SERIES TRUS
ENTX,ENTERA BIO LTD SHS (ISR)
ENTXW,"EVERQUOTE, INC. WARRANT (ISR) "
ENV,"ENVESTNET, INC. COM STK"
ENVA,ENOVA INTL INC COM STK (DE)
ENVB,ENVERIC BIOSCIENCES INC
ENVIW,ENVIRONMENTAL IMPACT ACQUISITI
ENX,EATON VANCE NY MUNI BOND
ENZ,"ENZO BIOCHEM,INC."
ENZC,ENZOLYTICS INC
ENZL,ISHARES TR MSCI NEW ZEALAND ET
EOCWU,ELLIOTT OPPORTUNITY II CORP UN
EOD,WELLS FARGO GLOBAL DIVID OPPOR
EOG,"EOG RESOURCES,INC"
EOI,EATON VANCE ENHANCED EQUITY IN
EOLS,EVOLUS INC COM (DE)
EONGY,E.ON SE SPONSORED ADR (GERMANY
EOPS,EMLES TR ALPHA OPPORTUNITIES E
EOS,EATON VANCE ENHANCED EQUITY IN
EOSE,EOS ENERGY ENTERPRISES INC COM
EOSEW,EOS ENERGY ENTERPRISES INC
EOT,EATON VANCE NATL MUN OPPORTUNI
EPAC,ENERPAC TOOL GROUP CORP CL A C
EPAM,EPAM SYS INC COM STK (DE)
EPAY,BOTTOMLINE TECH INC DEL
EPC,EDGEWELL PERS CAR COMPANY COM 
EPD,ENTERPRISE PRODS PARTNERS LP
EPHE,ISHARES MSCI PHILIPPINES ETF
EPHY,EPIPHANY TECHNOLOGY ACQUISITIO
EPHYW,EPIPHANY TECHNOLOGY ACQUISITIO
EPI,WISDOMTREE TR INDIA EARNINGS F
EPIX,ESSA PHARMA INC COM STK (CDA) 
EPM,EVOLUTION PETROLEUM CORP COM
EPOKY,EPIROC AKTIEBOLAG ADR (SWE)
EPOL,ISHARES TR MSCI POLAND ETF
EPP,ISHARES INC
EPPRC,EL PASO ENR CP TSTI 4.75%
EPR,EPR PPTYS COM SH BEN INT (MD) 
EPRE,FIRST TR EXCH TRAD FD VIII TCW
EPRF,INNOVATOR S&P INVESTMENT GRADE
EPRPRC,EPR PPTYS 5.75 SER C CUM CONV 
EPRPRE,EPR PPTYS PFD CONV SER E 9.00%
EPRT,ESSENTIAL PROPERTIES REALTY TR
EPS,WISDOMTREE U.S. LARGECAP FUND 
EPTI,ENVIRONMENTAL PACKAG
EPU,ISHARES MSCI PERU ETF
EPWR,EMPOWERMENT & INCLUSION CAP I 
EPWRWS,EMPOWERMENT & INCLUSION CAP I 
EPZM,EPIZYME INC COM STK (DE)
EQ,EQUILLIUM INC COM (DE)
EQAL,INVESCO ETF
EQBK,EQUITY BANCSHARES INC COM
EQC,EQUITY COMWLTH COM SH BEN INT 
EQCPRD,EQUITY COMWLTH CUM RED PFD SE 
EQD,EQUITY DISTR ACQUISITION CORP 
EQDWS,EQUITY DISTR ACQUISITION CORP 
EQH,EQUITABLE HLDGS INC COM (DE)
EQHA,EQ HEALTH ACQUISITION CORP CL 
EQHAWS,EQ HEALTH ACQUISITION CORP WT 
EQHPRA,EQUITABLE HLDGS INC DEP SHS RE
EQHPRC,EQUITABLE HLDGS INCDEP SHS REP
EQIX,EQUINIX INC COMMON STOCK REIT 
EQL,ALPS ETF TR EQUAL SECTOR WEIGH
EQLB,EQ LABS INC COM STK (FL)
EQMEF,EQUITY METALS CORP (CANADA)
EQNR,EQUINOR ASA SPONSORED ADR (NOR
EQOP,NATIXIS ETF TR II U S EQUITY O
EQOS,DIGINEX LTD COM (SGP)
EQR,EQUITY RESIDENTIAL
EQRR,PROSHARES TR EQUITIES FOR RISI
EQT,EQT CORPORATION COM STK
EQTRF,ALTAMIRA GOLD CORP (CANADA)
EQWL,INVESCO EXCHANGE-TRADED FD TR 
EQX,EQUINOX GOLD CORP EQUINOX GOLD
ERC,WELLS FARGO MULTI-SECTOR INCOM
ERDCF,ERDENE RESOURCE DEVELOPMENT CO
ERES,EAST RES ACQUISITION CO CLASS 
ERESU,EAST RESOURCES ACQUISITION COM
ERESW,EAST RES ACQUISITION CO WT EXP
ERF,ENERPLUS CORPORATION (CDA)
ERGO,ENTIA BIOSCIENCES INC. COMMON 
ERH,WELLS FARGO UTILITIES AND HIGH
ERIC,ERICSSON L M TEL CO ADR CL B S
ERIE,ERIE INDEMNITY CO CL-A
ERII,"ENERGY RECOVERY, INC. COM STK "
ERJ,EMBRAER SA SPON ADR REPSTG 4 C
ERM,FIRST TR ETF VIII EQUITYCOMPAS
ERO,ERO COPPER CORP COM(CAN)
EROSF,EROS RES CORP COM (CDA)
ERSX,ENTREPRENEURSHARES SR TR ERSHA
ERTH,INVESCO ETF TR INVESCO MSCI SU
ERUS,ISHARES INC MSCI RUSSIA ETF (D
ERX,DIREXION DAILY ENERGY BULL 2X 
ERY,DIREXION DAILY ENERGY BEAR 2X 
ES,EVERSOURCE ENERGY COM SHS
ESALY,EISAI CO LTD SPONS ADR (NEW)
ESBK,ELMIRA SVGS BK ELMIRA N Y
ESCA,ESCALADE INC
ESCR,XTRACKERS BLOOMBERG BARCLAYS U
ESE,ESCO TECHNOLOGIES INC
ESEA,EUROSEAS LTD SHS NEW 2019 (MHL
ESEB,XTRACKERS J.P. MORGAN ESG EMER
ESG,FLEXSHARES STOXX US ESG SELECT
ESGA,AMERICAN CENTY ETF TR SUSTAINA
ESGB,INDEXIQ ACTIVE ETF TR IQ MACKA
ESGC,EROS STX GLOBAL CORPORATION(IM
ESGD,ISHARES TRUST ISHARES ESG AWAR
ESGE,"ISHARES, INC. ISHARES ESG AWAR"
ESGN,COLUMBIA ETF TR I SUSTAINABLE 
ESGR,ENSTAR GROUP LIMITED ORD SHS
ESGRO,ENSTAR GROUP LTD DEP SHS EACH 
ESGRP,ENSTAR GRP LTD DEP SHS REPSTG 
ESGS,COLUMBIA ETF TR ISUSTAINABLE U
ESGU,ISHARES TRUST ISHARES ESG AWAR
ESGV,VANGUARD WORLD FD ESG U.S. STO
ESGY,AMERICAN CENTY ETF TR SUSTAINA
ESHY,XTRACKERS J.P. MORGAN ESG USD 
ESI,ELEMENT SOLUTIONS INC COM
ESIFF,ESG GLOBAL IMPACT CAP INC
ESLOY,ESSILORLUXOTTICA AMERICAN DEPO
ESLT,ELBIT SYSTEMS LTD
ESMC,ESCALON MEDICAL CORP
ESML,ISHARES ESG AWARE MSCI USA SMA
ESMWS,ESM ACQUISITION CORP WT EXP
ESNG,DIREXION SHS ETF TR MSCI USA E
ESNT,ESSENT GROUP LTD COM SHS (BMU)
ESOA,ENERGY SVCS OF AMER CORP
ESPO,VANECK VECTORS ETF TR VIDEO GA
ESPR,ESPERION THERAPEUTICS INC NEW 
ESQ,ESQUIRE FINL HLDGS INC COM
ESRT,EMPIRE ST RLTY TR INC CL A (MD
ESS,ESSEX PROPERTY TRUST INC
ESSA,"ESSA BANCORP, INC"
ESSCW,EAST STONE ACQUISITION CORP
ESTA,ESTABLISHMENT LABS HLDGS INC C
ESTC,ELASTIC N V USD SHS (NLD)
ESVIF,ENSIGN ENERGY SERVICES INC.
ESVNF,E79 RES CORP (CANADA)
ESXB,COMMUNITY BANKERS TRUST CORPOR
ESYJY,EASYJET PLC SPONSORED ADR (UK)
ET,ENERGY TRANSFER LP
ETAC,E MERGE TECHNOLOGY ACQUISITION
ETACW,E MERGE TECHNOLOGY ACQUISITION
ETB,EATON VANCE TAX-MANAGED BUY-WR
ETCMY,EUTELSAT COMMUNICATIONS S A SP
ETFLF,EASTFIELD RES LTD
ETG,EATON VANCE TAX ADV GLB DVD IN
ETH,ETHAN ALLEN INTERIORS INC
ETHO,ETF MANAGERS TR
ETHOF,ETHOS GOLD CORP. ORDINARY SHAR
ETIPR,ENTERGY TEX INC PFD SER A
ETJ,EATON VANCE-MANAGED DIVERSIFIE
ETN,EATON CORP PLC (IRL)
ETNB,89BIO INC COM
ETO,EATON VANCE TAX-ADVANTAGED GLO
ETON,ETON PHARMACEUTICALS INC COM (
ETPRC,ENERGY TRANSFER LP 7.375% PERP
ETPRD,ENERGY TRANSFER L P 7.625% PER
ETPRE,ENERGY TRANSFER L P 7.6% PERP 
ETR,ENTERGY CORP (NEW)
ETRN,EQUITRANS MIDSTREAM CORP
ETRUF,ETRUSCUS RES CORP (CANADA)
ETST,EARTH SCIENCE TECH INC COM STK
ETSY,ETSY INC COM
ETTX,ENTASIS THERAPEUTICS HLDGS INC
ETV,EATON VANCE TAX-MANAGED BUY-WR
ETW,EATON VANCE TAX-MANAGED GLOBAL
ETWO,E2OPEN PARENT HLDGS INC CL A
ETWOWS,E2OPEN PARENT HLDGS INC WT EXP
ETX,EATON VANCE MUN INCOME 2028 TE
ETY,EATON VANCE TAX MANAGED DIVERS
EUCG,TIDAL ETF TR EUCLID CAP GROWTH
EUCRU,EUCRATES BIOMED ACQUISIT CORP 
EUCRW,EUCRATES BIOMEDICAL ACQUISITIO
EUDG,WISDOMTREE TR
EUDV,PROSHARES TR MSCI EUROPE DIVID
EUFN,ISHARES MSCI EUROPE FINANCIALS
EUO,PROSHARES TR 11 PROSHARES ULTR
EURL,DIREXION DAILY FTSE EUROPE BUL
EURN,EURONAV NV ANTWERPEN (BELGIUM)
EURZ,DBX ETF TR XTRACKERS EUROZONE 
EUSA,ISHARES MSCI USA EQUAL WEIGHTE
EUSB,ISHARES TR ESG ADVANCED TOTAL 
EUSC,WISDOMTREE TR EUROPE HEDGED SM
EUSGW,EUROPEAN SUSTAINABLE GROWTH AC
EUSP,EUROSITE POWER INC. COMMON (DE
EUUNF,AZARGA METALS CORP COM (CANADA
EVA,ENVIVA PARTNERS LP COM UNIT RE
EVAHF,EGF THERAMED HEALTH CORP
EVAX,EVAXION BIOTECH A/S ADS
EVBG,EVERBRIDGE INC. COM
EVC,ENTRAVISION COMMUNICATNS CL A 
EVCM,EVERCOMMERCE INC COM
EVF,EATON VANCE SR INCM TST SBI
EVFM,EVOFEM BIOSCIENCES INC COM (DE
EVG,EATON VANCE SHORT DURATION DIV
EVGN,EVOGENE LTD ORD SHRS ORD SHARE
EVGO,EVGO INC CL A COM
EVGOW,EVGO INC WT EXP 09/15/25
EVH,"EVOLENT HEALTH,INC CLASS A COM"
EVI,EVI INDS INC COM (DE)
EVK,EVER-GLORY INTERNATIONAL GROUP
EVLI,EVERLERT INC COM PAR $0.001 (N
EVLLF,ENVIROLEACH TECHNOLO (CANADA) 
EVLMC,EATON VANCE II TABS 5TO15 YR L
EVLO,EVELO BIOSCIENCES INC COM
EVM,EATON VANCE CALIF MUNI BOND
EVN,EATON VANCE MUNI INC TRUST SBI
EVOJW,EVO ACQUISITION CORP WT EXP 01
EVOK,EVOKE PHARMA INC
EVOL,EVOLVING SYSTEMS INC COM STK
EVOP,EVO PMTS INC
EVR,EVERCORE INC. CL-A COM
EVRG,EVERGY INC COM
EVRI,EVERI HLDGS INC COM
EVSBY,EVS BORADCAST EQUIPMENT S A AD
EVT,EATON VANCE TAX-ADVTG DIVIDEND
EVTC,EVERTEC INC COM
EVTCY,EVOTEC SE AMERICAN DEPOSITARY 
EVTN,"ENVIRO TECHNOLOGIES U.S., INC."
EVUS,EV CHARGING USA INC
EVV,EATON VANCE LTD DUR INCM FD SB
EVVTY,EVOLUTION AB AMERICAN DEPOSITA
EVX,VANECK VECTORS ENVIRONMENTAL S
EVXXF,EUROPEAN ELEC METALS INC COM N
EVY,EATON VANCE NY MUNI INC TST
EW,EDWARDS LIFESCIENCES CORP
EWA,ISHARES MSCI AUSTRALIA ETF
EWBC,EAST WEST BANCORP INC
EWC,ISHARES MSCI CANADA ETF
EWCO,INVESCO ETF TR S&P 500 EQUAL W
EWD,ISHARES INC MSCI SWEDEN ETF
EWG,ISHARES MSCI GERMANY ETF
EWGS,ISHARES MSCI GERMANY SMALL CAP
EWH,ISHARES MSCI HONG KONG ETF
EWI,ISHARES INC MSCI ITALY ETF
EWJ,ISHARES MSCI JAPAN ETF
EWJV,ISHARES TR MSCI JAPAN VALUE ET
EWK,ISHARES INC MSCI BELGIUM ETF
EWL,ISHARES INC MSCI SWITZERLND
EWLL,EWELLNESS HEALTHCARE CORP
EWLU,MERION INC
EWM,ISHS MSCI MALAYSIA ETF
EWMC,INVESCO EXCHANGE-TRADED FD TR 
EWN,ISHARES MSCI NETHERLNDS ETF
EWO,ISHARES INC MSCI AUSTRIA ETF
EWP,ISHARES INC MSCI SPAIN ETF
EWQ,ISHARES MSCI FRANCE ETF
EWRE,INVESCO S&P 500 EQUAL WEIGHT R
EWS,ISHARES INC MSCI SINGAPORE ETF
EWSC,INVESCO
EWT,ISHARES INC MSCI TAIWAN ETF
EWTX,EDGEWISE THERAPEUTICS INC COM 
EWU,ISHS MSCI UTD KINGDOM ETF
EWUS,ISHARES MSCI UNITED KINGDOM SM
EWV,PROSHARES ULTRASHORT MSCI JAPA
EWW,ISHARES INC MSCI MEXICO ETF
EWX,SPDR S&P EMERGING MARKETS SMAL
EWY,ISHARES INC MSCI SOUTH KOREA E
EWZ,ISHARES INC MSCI BRAZIL ETF
EWZS,ISHARES MSCI BRAZIL SMALL CAP 
EXAS,EXACT SCIENCES CORPORATION
EXBX,EXOBOX TECHNOLOGIES CORP.
EXC,EXELON CORPORATION
EXDI,EXACTUS INC
EXEL,EXELIXIS INC
EXFO,EXFO INC (CDA)
EXG,EATON VANCE TAX MANAGED GLOBAL
EXHI,EXLITES HOLDINGS INTERNATIONAL
EXI,ISHARES GLOBAL INDUSTRIALS ETF
EXK,ENDEAVOUR SILVER CORP
EXN,EXCELLON RES INC (CANADA)
EXP,EAGLE MATERIALS INC
EXPD,EXPEDITORS INTL OF WASH INC
EXPE,"EXPEDIA GROUP,INC. COM NEW"
EXPFF,CITIZEN STASH CANNABIS CORP
EXPGY,Experian Plc Sponsored ADR (UK
EXPI,"EXP WORLD HOLDINGS, INC. COMMO"
EXPO,EXPONENT INC
EXPR,"EXPRESS, INC COM STK"
EXR,EXTRA SPACE STORAGE INC
EXROF,EXRO TECHNOLOGIES INC COM(CANA
EXSR,EXCHANGE BK SANTA ROSA CAL
EXTN,EXTERRAN CORP COM STK (DE)
EXTR,EXTREME NETWORKS INC
EYE,NATIONAL VISION HLDGS INC COM 
EYEG,EYEGATE PHARMACEUTICALS INC CO
EYEN,EYENOVIA INC COM (DE)
EYES,SECOND SIGHT MED PRODS INC COM
EYESW,SECOND SIGHT MED PRODS INC WT 
EYLD,CAMBRIA ETF TR EMERGING SHAREH
EYPT,"EYEPOINT PHARMACEUTICALS, INC."
EZA,ISHARES MSCI SOUTH AFRICA ETF 
EZGO,EZGO TECHNOLOGIES LTD USD ORD 
EZJ,PROSHARES TR ULTRA MSCI JAPAN 
EZM,WISDOMTREE U.S. MIDCAP FUND
EZOO,EZAGOO LTD COM
EZPW,EZCORP INC CL-A
EZU,ISHARES INC MSCI EUROZONE ETF 
F,FORD MOTOR CO;COM STK USD0.01 
FA,FIRST ADVANTAGE CORP NEW
FAAR,FIRST TRUST VII ALTERNATIVE AB
FAB,FIRST TR MULTI CAP VALUE ALPHA
FACA,FIGURE ACQUISITION CORP I CL A
FACAWS,FIGURE ACQUISITION CORP I
FACTWS,FREEDOM ACQUISITION I CORP
FAD,FIRST TR MULTI CAP GROWTH ALPH
FAF,FIRST AMERICAN FINANCIAL CORPO
FAIL,CAMBRIA GLOBAL TAIL RISK ETF
FALN,ISHARES TR FALLEN ANGELS USD B
FAM,FIRST TRUST/ABERDEEN GLOBAL OP
FAMI,FARMMI INC ORDINARY SHARES (CY
FAN,FIRST TR EXCHANGE TRADED FD II
FANG,DIAMONDBACK ENERGY INC COM
FANH,FANHUA INC SPONSORED ADR (CAYM
FANUY,FANUC CORPORATION UNSPONSORED 
FAPR,FIRST EX TR FD VIII FT CBOE VE
FARM,FARMER BROTHERS CO
FARO,FARO TECHNOLOGIES INC
FAS,DIREXION DAILY FINANCIAL BULL 
FAST,FASTENAL CO
FAT,FAT BRANDS INC COM
FATBP,FAT BRANDS INC CUMULATIVE
FATE,FATE THERAPEUTICS INC
FATT,COLLABORATIVE INVT SER TR FAT 
FAUG,FIRST TR ETF VIII CBOE VEST US
FAX,ABERDEEN ASIA-PACIFIC INCOME F
FAZ,DIREXION SHS ETF TR DIREXION D
FB,FACEBOOK INC CL A COM STK (DE)
FBAYF,KNEAT COM INC COM (CAN)
FBC,FLAGSTAR BANCORP INC
FBCD,"FBC HOLDING, INC. COMMON STOCK"
FBCG,FIDELITY COVINGTON TR BLUE CHI
FBCV,FIDELITY COVINGTON TR BLUE CHI
FBHS,FORTUNE BRANDS HOME & SEC INC 
FBIO,FORTRESS BIOTECH INC
FBIOP,FORTRESS BIOTECH INC CUM RED P
FBIZ,FIRST BUSINESS FINANCAIL SERVI
FBMS,FIRST BANCSHARES INC (THE) (MS
FBNC,FIRST BANCORP (TROY N.C)
FBND,FIDELITY MERRIMACK STR TR TOTA
FBP,FIRST BANCORP COM STK NEW (PR)
FBPA,FARMERS BANK OF APPOMATTOX VA 
FBRX,FORTE BIOSCIENCES
FBT,FIRST TRUST NYSE ARCA BIOTECHN
FBTT,FIRST BANKERS TRUSTSHARES INC 
FBZ,FIRST TRUST BRAZIL ALPHADEX FU
FC,FRANKLIN COVEY CO.
FCA,FIRST TRUST CHINA ALPHADEX FUN
FCAC,FALCON CAP ACQUISITION CORP CL
FCACW,FALCON CAP ACQUISITION CORP
FCAL,FIRST TR III CALIF MUN HIGH IN
FCAP,FIRST CAP INC
FCAX,FORTRESS CAP ACQUISITION CORP 
FCAXWS,FORTRESS CAP ACQUISITION CORP 
FCBC,FIRST COMMUNTY BANCSHRS INC(VA
FCCO,FIRST COMMUNITY CORP (SC)
FCCY,1ST CONSTITUTION BANCORP
FCEF,FIRST TR ETF VIII CEF INCOME O
FCEL,FUELCELL ENERGY INC COM PAR $ 
FCF,FIRST COMMONWEALTH FINL CORP
FCFS,FIRSTCASH INC COM (DE)
FCG,FIRST TR EXCHANGE-TRADED FD
FCIC,FCCC INC
FCIT,FIRST CITRUS BANCORPORATION IN
FCN,FTI CONSULTING INC
FCNCA,FIRST CITIZENS BKCSHARES CL-A 
FCNCP,FIRST CTZNS BANCSHARES INC DEL
FCO,ABERDEEN GLOBAL INCOME FUND IN
FCOM,FIDELITY COVINGTON TR MSCI COM
FCOR,FIDELITY MERRIMACK STR TR CORP
FCPI,FIDELITY COVINGTON TR STOCKS F
FCPT,FOUR CORNERS PPTY TR INC COM S
FCRD,FIRST EAGLE ALTERNATIVE CAP BD
FCREY,FLETCHER BLDG LTD
FCRW,FIRST EAGLE ALTERNATIVE CAP BD
FCRX,FIRST EAGLE ALTERNAT CAP BDC I
FCT,FIRST TR SR FLTG RT INCM FD II
FCTR,FIRST TR EXCHANGE-TRADED FD
FCUUF,FISSION URANIUM CORPORATION CO
FCVT,FIRST TR EXCHANGE TRADED FD IV
FCX,FREEPORT-MCMORAN INC COM STK C
FDBC,FIDELITY D & D BANCOR INC
FDBL,FRIENDABLE INC COM NEW
FDCFF,FORUM ENERGY METALS (CANADA)
FDCT,FDCTECH INC COM
FDD,FIRST TRUST STOXX EUROPEAN SEL
FDEC,FIRST TR EX TR FD VIII FT CBOE
FDEM,FIDELITY EMERGING MARKETS MULT
FDEU,FIRST TR DYNAMIC EUROPE EQUITY
FDEV,FIDELITY INTERNATIONAL MULTIFA
FDG,AMERICAN CENTY ETF TR FOCUSED 
FDHY,FIDELITY COVINGTON TRUST HIGH 
FDIS,FIDELITY COVINGTON TR MSCI CON
FDIV,FIRST TRUST STRATEGIC INCOME
FDL,FIRST TR MORNINGSTAR DIVIDEND 
FDLO,FIDELITY COVINGTON TR LOW VOLA
FDM,FIRST TRUST DOW JONES SELECT M
FDMO,FIDELITY COVINGTON TR MOMENTUM
FDMSF,FANDOM SPORTS MEDIA CORP
FDMT,4D MOLECULAR THERAPEUTICS INC.
FDN,FIRST TR FD DOW JONES
FDNI,FIRST TR ETF II DOW JONES
FDP,FRESH DEL MONTE PRODUCE(ORD)
FDRR,FIDELITY COVINGTON TR DIVID ET
FDS,FACTSET RESEARCH SYSTEMS INC
FDT,FIRST TRUST DEVELOPED MARKETS 
FDTS,FIRST TR DEVELOPED MKTS EX-US 
FDUS,FIDUS INVT CORP
FDUSG,FIDUS INVESTMENT CORPORATION 5
FDUSZ,FIDUS INVT CORP 06.000% NTS DU
FDVV,FIDELITY HIGH DIVIDEND ETF
FDVXF,FENIXORO GOLD CORP (CANADA)
FDWM,FIDELITY COVINGTON TR WOMENS L
FDX,FEDEX CORPORATION
FE,FIRSTENERGY CORP
FECCF,FRONTERA ENERGY CORP (CANADA) 
FEDU,FOUR SEASONS ED CAYMAN INC
FEDX,EMLES TR FEDERAL CONTRACTORS E
FEERF,FREEPORT RES INC COM NEW (CAN)
FEI,FIRST TR MLP & ENERGY INCOME
FELE,FRANKLIN ELECTRIC CO
FELTY,Fuji Electric Holdings Co Ltd 
FEM,FIRST TRUST EMERGING MARKETS A
FEMB,FIRST TR ETF EMERGING MARKETS 
FEMFF,FIRST ENERGY METALS LTD
FEMS,FIRST TRUST EMERGING MARKETS S
FEMY,FEMASYS INC COM (DE)
FEN,FIRST TRUST ENERGY INCOME &
FENC,"FENNEC PHARMACEUTICALS, INC. O"
FENG,PHOENIX NEW MEDIA LTD SPONSORE
FENY,FIDELITY COVINGTON TR MSCI ENE
FEO,FIRST TRUST/ABERDEEN EMERGING 
FEP,FIRST TRUST EUROPE ALPHADEX FU
FERG,"FERGUSON PLC NEW (JERSEY, C.I."
FERN,FERNHILL CORP. COMMON STOCK
FET,FORUM ENERGY TECHNOLOGIES INC 
FETM,"FENTURA FINANCIAL, INC."
FEVR,NORTHERN LTS FD TR IV INSPIRE 
FEX,FIRST TR LARGE CAP CORE ALPHDE
FEYE,FIREEYE INC COM
FEZ,SPDR EURO STOXX 50 ETF
FF,FUTUREFUEL CORP COM STK
FFA,FIRST TRUST ENHANCED EQUITY IN
FFBC,FIRST FINANCIAL BANCORP (OH)
FFBW,FFBW INC MD COM (MD)
FFC,FLAHERTY & CRUMRINE PFD AND SE
FFHG,NORTHERN LTS FD TR IV FORMULA 
FFHL,FUWEI FILMS HOLDINGS CO LTD SH
FFIC,FLUSHING FINANCIAL CORPORATION
FFIN,FIRST FINL BANKSHARES INC
FFIV,F5 NETWORKS INC
FFMGF,FIRST MNG GOLD CORP (CANADA)
FFNTF,4FRONT VENTURES CORP COM SUB V
FFR,FIRST TR EPRA/NAREIT DEVEL MKT
FFRMF,FUTURE FRAM TECHNOLO (CANADA) 
FFTG,NORTHERN LTS FD TR IV ETF
FFTY,INNOVATOR ETFS TR IBD 50 ETF (
FFWM,FIRST FOUNDATION INC COM
FFZY,FANSFRENZY CORP COM
FGB,FIRST TRUST SPECIALTY FINANCE 
FGBI,"FIRST GUARANTY BANCSHARES, INC"
FGBIP,FIRST GTY BANCSHARES INC
FGD,FIRST TR EXCHANGE TRD FD II FI
FGEN,FIBROGEN INC COMMON STOCK
FGF,"FG FINANCIAL GROUP, INC. COM S"
FGFH,FORESIGHT FINANCIAL GR INC
FGFPP,"FG FINANCIAL GROUP, INC. 8.% C"
FGM,FIRST TRUST GERMANY ALPHADEX F
FGNA,FG NEW AMER ACQUISITION CORP C
FGNAWS,FG NEW AMER ACQUISITION CORP W
FGPR,FERRELLGAS PARTNERS L P
FGRO,FIDELITY COVINGTON TR
FHB,FIRST HAWAIIAN INC COM
FHBI,BAYFIRST FINL CORP
FHI,"FEDERATED HERMES, INC."
FHLC,FIDELITY COVINGTON TR MSCI HEA
FHN,FIRST HORIZON CORPORATION
FHNPRA,FIRST HORIZON CORP 4MM DEP SHS
FHNPRB,FIRST HORIZON CORP DEP SHS REP
FHNPRC,FIRST HORIZON CORP DEP SHS REP
FHNPRE,FIRST HORIZON CORP
FHNPRF,FIRST HORIZON CORP DEP SH REPS
FHS,FIRST HIGH-SCH ED GRP CO LTD
FHTX,FOGHORN THERAPEUTICS INC COM (
FI,FRANKS INTERNATIONAL N.V. COM 
FIBK,FIRST INTST BANCSYSTEM INC CL 
FIBR,ISHARES U.S. FIXED INCOME BALA
FICO,FAIR ISAAC CORPORATION
FICS,FIRST TR EXCHANGE-TRADED FD VI
FICVU,FRONTIER INVT CORP UNIT 1 ORD 
FID,FIRST TR EXCHANGE-TRDED FD VI 
FIDU,FIDELITY COVINGTON TR MSCI IND
FIEIF,OTSO GOLD CORP (CANADA)
