SYMBOL,DESCRIPTION
A,"AGILENT TECHNOLOGIES, INC"
AA,ALCOA UPSTREAM CORP COM STK(DE
AAAU,GOLDMAN SACHS PHYSICAL GOLD ET
AABB,ASIA BROADBAND INC
AABVF,ABERDEEN INTERNATIONAL INC
AAC,ARES ACQUISITION CORP CL A ORD
AACAY,AAC TECHNOLOGIES HOLDINGS INC 
AACG,ATA CREATIVITY GLOBAL SPONSORE
AACS,AMERICAN COMMERCE SLTS INC
AACTF,AURORA SOLAR TECHNOLOGIES INC 
AACWS,ARES ACQUISITION CORP WT EXP
AAGFF,AFTERMATH SILVER LTD (CANADA) 
AAGH,AMERICA GREAT HEALTH
AAGIY,AIA GROUP LTD SPONSORED ADR HO
AAGRY,ASTRA AGRO LESTARI TBK PT UNSP
AAIC,ARLINGTON ASSET INVT CORP CL A
AAICPRB,ARLINGTON ASSET INVT CORP
AAICPRC,ARLINGTON ASSET INVT CORP CUM 
AAIRF,AMERICAN AIRES INC (CANADA)
AAL,AMERICAN AIRLINES GROUP INC CO
AAMC,ALTISOURCE ASSET MANAGEMENT CO
AAME,ATLANTIC AMERICAN CORP
AAN,AARONS CO INC COM
AAOI,APPLIED OPTOELECTRONICS INC CO
AAON,AAON INC
AAP,ADVANCE AUTO PARTS INC
AAPL,APPLE INC;COM NPV
AAPT,"ALL AMERICAN PET COMPANY, INC."
AAQC,ACCELERATE ACQUISITION CORP CL
AAQCWS,ACCELERATE ACQUISITION CORP WT
AAT,AMERICAN ASSETS TR INC COM STK
AAU,ALMADEN MINERALS LTD COM CLASS
AAUGF,ANGOLD RES LTD (CANADA)
AAVMY,ABN AMRO BK N V AMSTERDAM BRH 
AAVVF,ADVANTAGE ENERGY LTD (CANADA) 
AAWW,ATLAS AIR WORLDWIDE HLDGS NEW 
AAXJ,ISHARES MSCI ALL COUNTRY ASIA 
AAZZF,A2Z SMART TECHNOLOGIES CORP CO
AB,ALLIANCEBERNSTEIN HOLDING L.P.
ABB,ABB LTD ADS ( 1 REG SHS)
ABBRF,ABRASILVER RESOURCE CORP
ABBV,ABBVIE INC COM STK (DE)
ABC,AMERISOURCEBERGEN CORP
ABCB,AMERIS BANCORP
ABCFF,ABACUS MNG & EXPL CO (CANADA) 
ABCL,ABCELLERA BIOLOGICS INC. (CAN)
ABCM,ABCAM PLC SPONSORED ADS
ABEO,ABEONA THERAPEUTICS INC
ABEPF,VISION LITHIUM INC (CANADA)
ABEQ,UNIFIED SER TR ABSOLUTE CORE S
ABEV,AMBEV S A SPONSORED ADR (BRA) 
ABG,ASBURY AUTOMOTIVE GROUP INC.
ABIO,ARCA BIOPHARMA INC COM PAR $.0
ABM,ABM INDUSTRIES INC
ABMBF,ABCOURT MINES INC CL-B (F)
ABMD,ABIOMED INC
ABML,AMERICAN BATTERY METALS CORP N
ABNB,AIRBNB INC CLASS A
ABOS,ACUMEN PHARMACEUTICALS INC COM
ABPR,AIRBORNE SEC & PROTECTIVE SVCS
ABQQ,AB INTL GROUP CORP COM NEW
ABR,ARBOR REALTY TRUST INC
ABRPRD,ARBOR RLTY TR INC PFD SER D % 
ABSSF,AIRBOSS OF AMERICA CP NEW(F)
ABST,ABSOLUTE SOFTWARE CORP
ABT,ABBOTT LABS;COM NPV
ABUS,ARBUTUS BIOPHARMA CORP COM STK
AC,ASSOCIATED CAP GROUP INC CLASS
ACA,ARCOSA INC COM
ACAD,ACADIA PHARMACEUTICALS INC
ACAH,ATLANTIC COASTAL ACQUISITION C
ACAHW,ATLANTIC COASTAL ACQUISITION C
ACB,AURORA CANNABIS INC COM (CANAD
ACBAW,ACE GLOBAL BUSINESS ACQSTN LTD
ACBI,ATLANTIC CAP BANCSHARES INC CO
ACC,AMERICAN CAMPUS COMMUNITIES IN
ACCD,ACCOLADE INC COM
ACCO,ACCO BRANDS CORPORATION
ACCYY,ACCOR S A (FRANCE)
ACDVF,AIR CANADA INC VTG & VAR VTG S
ACEL,ACCEL ENTMT INC COM CL A-1 (IL
ACER,ACER THERAPEUTICS INC. COMMON 
ACES,ALPS ETF TR CLEAN ENERGY ETF
ACET,ADICET BIO INC
ACEV,ACE CONVERGENCE ACQUISITION CO
ACEVW,ACE CONVERGENCE ACQUISITION CO
ACGBY,AGRICULTURAL BANK OF CHINA UNS
ACGL,ARCH CAPITAL GROUP LTD
ACGLN,ARCH CAP GROUP LTD DEP SHS REP
ACGLO,ARCH CAP GROUP LTD (BMU)
ACGLP,ARCH CAP GROUP LTD DS RPTG 1/1
ACH,ALUIMINUM CORP OF CHINA ADR (2
ACHL,ACHILLES THERAPEUTICS PLC
ACI,"ALBERTSONS COMPANIES, INC."
ACIC,ATLAS CREST INVT CORP CL A (DE
ACICU,ATLAS CREST INVT CORP UNIT 1 C
ACICWS,ATLAS CREST INVT CORP WT EXP 0
ACII,ATLAS CREST INVT CORP II COM C
ACIIWS,ATLAS CREST INVT CORP II WT EX
ACIO,ETF SER SOLUTIONS APTUS COLLAR
ACIU,AC IMMUNE SA SHS (CHE)
ACIW,ACI WORLDWIDE INC COM STK (DE)
ACKAY,Arcelik A S Unsponsored ADR (T
ACKIT,ACKRELL SPAC PARTNERS I CO SUB
ACKIW,ACKRELL SPAC PARTNERS I CO WT 
ACLLF,ATCO LTD CL-I NON VTG
ACLS,AXCELIS TECHNOLOGIES INC COM N
ACLTF,ATCO LTD CL-II VTG
ACM,AECOM COM STK (DE)
ACMR,ACM RESH INC CL A
ACN,ACCENTURE PLC CL-A ORDINARY SH
ACNB,ACNB CORP
ACND,ASCENDANT DIGITAL ACQUISITION 
ACNDWS,ASCENDANT DIGITAL ACQUISITION 
ACOR,ACORDA THERAPEUTICS INC COM NE
ACP,ABERDEEN INCOME CR STRATEGIES 
ACPPRA,ABERDEEN INCOME CR STRATEGIES 
ACQRW,INDEPENDENCE HLDGS CORP. USD R
ACR,ACRES COML RLTY CORP COM
ACRDF,ACREAGE HLDGS INC SHS CL D SUB
ACRHF,ACREAGE HLDGS INC SHS CL E SUB
ACROU,ACROPOLIS INFRASTRUCTURE ACQ C
ACRPRC,ACRES COML RLTY CORP PFD SER C
ACRPRD,ACRES COML RLTY CORP
ACRS,ACLARIS THERAPEUTICS INC COM
ACRX,ACELRX PHARMACEUTICALS INC COM
ACSAY,ACS Actividades De Construccio
ACSG,DBX ETF TR XTRACKERS MSCI ACWI
ACSI,TIDAL ETF TR AMERN CUSTOMER SA
ACST,ACASTI PHARMA INC CL A SHS (CD
ACTD,ARCLIGHT CLEAN TRANSITION CORP
ACTDW,ARCLIGHT CLEAN TRANSITION CORP
ACTG,ACACIA RESEARCH CORP AR ACIACI
ACTV,TWO RDS SHARED TR LEADERSHARES
ACV,VIRTUS ALLIANZGI DIVERSINCOME 
ACVA,ACV AUCTIONS INC CL A
ACVF,ETF OPPORTUNITIES TR AMERICAN 
ACWF,ISHARES MSCI GLOBAL MULTIFACTO
ACWI,ISHARES MSCI ACWI ETF
ACWV,ISHARES MSCI GLOBAL MIN VOL FA
ACWX,ISHARES MSCI ACWI EX US ETF
ACXP,ACURX PHARMACEUTICALS INC COM 
ACY,AEROCENTURY CORP
ADAG,ADAGENE INC ADS (CYM)
ADAP,ADAPTIMMUNE THERAPEUTICS PLC S
ADBE,ADOBE INC COM (DE)
ADC,AGREE REALTY CORP
ADCT,ADC THERAPEUTICS SA SHS
ADDYY,ADIDAS AG SPONSORED ADR (GERMA
ADER,26 CAP ACQUISITION CORP CL A
ADERW,26 CAP ACQUISITION CORP RED WT
ADES,ADVANCED EMISSIONS SOLUTIONS I
ADEX,ADIT EDTECH ACQUISITION CORP
ADEXWS,ADIT EDTECH ACQUISITION CORP
ADF,ALDEL FINL INC CL A COM
ADFI,TWO RDS SHARED TR ANFIELD DYNA
ADFS,AMERICAN DEFENSE SYS INC COM S
ADFU,ALDEL FINL INC UNIT 1 COM & 1/
ADFWS,ALDEL FINL INC WT EXP 03/19/20
ADGO,ADVANTEGO CORP
ADI,ANALOG DEVICES INC
ADIL,ADIAL PHARMACEUTICALS INC COM 
ADILW,ADIAL PHARMACEUTICALS INC WT P
ADIV,GUINNESS ATKINSON FDS SMARTETF
ADM,ARCHER DANIELS MIDLAND CO
ADMA,ADMA BIOLOGICS INC COM
ADME,ETF SER SOLUTIONS APTUS DRAWND
ADMP,ADAMIS PHARMACEUTICALS CORP CO
ADMQ,ADM ENDEAVORS INC COM
ADMS,ADAMAS PHARMACEUTICALS INC COM
ADN,"ADVENT TECHNOLOGIES HOLDINGS, "
ADNWW,"ADVENT TECHNOLOGIES HOLDINGS, "
ADOCR,EDOC ACQUISITION CORP USD RTS 
ADP,AUTOMATIC DATA PROCESSING
ADPT,ADAPTIVE BIOTECHNOLOGIES CORP 
ADPXY,AUDIO PIXELS HOLDINGS LTD SPON
ADRA,ADARA ACQUISITION CORP CL A CO
ADRAWS,ADARA ACQUISITION CORP WT EXP 
ADRE,INVESCO BLDRS INDEX FDS TR EME
ADRNY,KONINKLIJKE AHOLD DELHAIZE N.V
ADS,ALLIANCE DATA SYSTEMS CORP
ADSK,AUTODESK INC (DE)
ADSV,"ALLIED SECURITY INNOVATIONS, I"
ADT,ADT INC DEL
ADTFF,IMETAL RES INC COM NEWCANADA) 
ADTM,"ADAPTIVE MEDIAS, INC. COMMON S"
ADTN,ADTRAN INC
ADTX,ADITXT INC COM
ADTX,ADITX THERAPEUTICS INC COM
ADV,ADVANTAGE SOLUTIONS INC
ADVM,ADVERUM BIOTECHNOLOGIES INC CO
ADVZF,ADVENTUS MNG CORP (CANADA)
ADX,ADAMS DIVERSIFIED EQUITY FUND 
ADXS,ADVAXIS INC COM PAR $0.001 (DE
ADYEY,ADYEN N V (NETHERLANDS)
AE,ADAMS RES & ENERGY NEW
AEAC,AUTHENTIC EQUITY ACQUISITION C
AEACW,AUTHENTIC EQUITY ACQUISITION C
AEB,AEGON NV PERP CAP SECS FLTG RA
AEE,AMEREN CORP
AEF,ABERDEEN EMERGING MARKETS EQUI
AEFC,AEGON FDG CO LLC SUB NTS RETAI
AEG,AEGON NV -ORD-
AEHL,ANTELOPE ENTERPRISE HLDGS LTD 
AEHR,AEHR TEST SYSTEMS
AEI,ALSET EHOME INTERNATIONAL INC.
AEIS,ADVANCED ENERGY INDS INC
AELPRA,AMERICAN EQUITY INVT LIFE HLDG
AELPRB,AMERICAN EQUITY INVT LIF HLD C
AEM,AGNICO EAGLE MINES LTD
AEMB,AMERICAN CENTY ETF TR EMERGING
AENZ,AENZA S A A SPONSORED ADR (PER
AEO,AMERICAN EAGLE OUTFITTER INC C
AEP,AMERICAN ELECTRIC POWER INC
AEPPL,AMERICAN ELEC PWR CO INC CORP 
AEPPZ,AMERICAN ELEC PWR CO
AER,AERCAP HOLDINGS NV ORD SHS
AERI,AERIE PHARMACEUTICALS INC COM 
AES,THE AES CORPORATION
AESC,AES CORP UNIT
AESE,ALLIED ESPORTS ENTMT INC COM
AESR,TWO RDS SHARED TRANFIELD US EQ
AETUF,ARC RESOURCES LTD. ORDINARY SH
AEVA,AEVA TECHNOLOGIES INC
AEVAWS,AEVA TECHNOLOGIES INC WT EXP
AEXAY,Atos Origin SA Unsponsored ADR
AEY,ADDVANTAGE TECHNOLOGIES GR INC
AEYE,AUDIOEYE INC
AEZS,AETERNA ZENTARIS INC COM STK (
AFAQ,AF ACQUISITION CORP CL A (DE) 
AFAQW,AF ACQUISITION CORP WT EXP 03/
AFB,ALLIANCEBERNSTEIN NATIONAL MUN
AFBI,AFFINITY BANCSHARES INC (MD)
AFCG,AFC GAMMA INC COM (MD)
AFDG,AFRICAN DISCOVERY GROUP INC
AFFU,AFFLUENCE CORP COM STK (CO)
AFG,AMERICAN FINL GP (HOLD CO)
AFGB,AMERICAN FINL GROUP INC OHIO S
AFGC,AMERICAN FINL GROUP INC OHIO S
AFGD,"AMERICAN FINANCIAL GROUP, INC."
AFGE,AMERICAN FINL GROUP INC OHIO
AFI,ARMSTRONG FLOORING INC COM
AFIB,ACUTUS MED INC
AFIF,TWO RDS SHARED TR
AFIN,AMERICAN FIN TR INC COM CL A
AFINO,AMERICAN FIN TR INC CUMULATIVE
AFINP,AMERICAN FIN TR INC PFD SER A 
AFK,VANECK VECTORS AFRICA INDEX ET
AFL,AFLAC INC
AFLG,FIRST TR EXCHANGE-TRADED FD VI
AFLYY,AIR FRANCE-KLM ADS (EA REPTG O
AFMD,AFFIMED N V ORDINARY SHARES(NL
AFMJF,ALPHAMIN RES CORP (MAURITIUS) 
AFOM,ALL FOR ONE MEDIA CO CORP COM 
AFPW,ALUMIFUEL POWER CORP
AFRM,AFFIRM HLDGS INC CL A
AFSIC,"AMTRUST FINANCIAL SVCS, INC. D"
AFSIM,AMTRUST FINL SVCS INC DEP SHS 
AFSIP,AMTRUST FINL SVCS INC DEP SHS 
AFSM,FIRST TR EXCHANGE-TRADED FD VI
AFT,APOLLO SR FLOATING RATE FD INC
AFTM,AFTERMASTER INC
AFTPY,AFTERPAY LTD ADR(AUSTRALIA)
AFTY,PACER FDS TR CSOP FTSE CHINA A
AFYA,AFYA LTD CL A COM
AG,FIRST MAJESTIC SILVER CORP ORD
AGAC,AFRICAN GOLD ACQUISITION CORP 
AGACU,AFRICAN GOLD ACQUISITION CORP 
AGACWS,AFRICAN GOLD ACQUISITION CORP 
AGAUF,ARIZONA GOLD CORP (CANADA)
AGC,ALTIMETER GROWTH CORP SHS CL A
AGCB,ALTIMETER GROWTH CORP 2
AGCBF,AMARILLO GOLD CORPORATION
AGCO,AGCO CORP
AGCUU,ALTIMETER GROWTH CORP UNIT 1 S
AGCWW,ALTIMETER GROWTH CORP WT
AGCZ,ANDES GOLD CORP
AGD,ABERDEEN GLOBAL DYNAMIC DIVID 
AGEN,AGENUS INC COM
AGESY,AGEAS SPONSORED ADR (BELGIUM) 
AGFAF,AGRAFLORA ORGANICS INTL INC CO
AGFS,AGROFRESH SOLUTIONS INC COM ST
AGFY,AGRIFY CORP
AGG,ISHARES CORE U.S. AGGREGATE BO
AGGFF,AFRICAN GOLD GROUP INC COM NEW
AGGI,ALLIED ENERGY INC COM STK (FL)
AGGL,AGTECH GLOBAL INTL I
AGGR,AGILE GROWTH CORP CL A (CYM)
AGGRU,AGILE GROWTH CORP UNIT 1 CL A 
AGGRW,AGILE GROWTH CORP WT EXP (CYM)
AGGY,WISDOMTREE YIELD ENHANCED U.S.
AGI,ALAMOS GOLD INC NEW COM CL A (
AGIN,AMERICAN GRAPHITE TECHNOLOGIES
AGIO,AGIOS PHARMACEUTICALS INC COM 
AGL,AGILON HEALTH INC COM (DE)
AGLE,"AEGLEA BIOTHERAPEUTICS, INC. C"
AGLXY,AGL ENERGY LTD (AUSTRALIA)
AGMH,AGM GROUP HLDGS INC USD CL A O
AGMPRD,FEDERAL AGRIC MTG CORP PFD SER
AGMPRE,FEDERAL AGRIC MTG CORP
AGMPRF,FEDERAL AGRIC MTG CORP
AGMPRG,FEDERAL AGRIC MTG CORP
AGNC,AGNC INVT CORP COM
AGNCM,AGNC INVT CORP CUM RED PFD SER
AGNCN,AGNC INVT CORP DEP SHS REPSTG 
AGNCP,AGNC INVT CORP DEP SHS REPSTG 
AGNG,GLOBAL X FUNDS GLOBAL X AGING 
AGNPF,ALGERNON PHARMACEUTICALS INC
AGOPRB,ASSURED GTY MUNI HLDGS INC 6.8
AGOPRE,ASSURED GUARANTY MUNI HDGS INC
AGOPRF,ASSURE GUARANTY MUNI HLDGS LTD
AGOX,STARBOARD INVT TR ADAPTIVE GRO
AGQ,PROSHARES ULTRA SILVER
AGR,AVANGRID INC COM
AGRI,AGRIFORCE GROWING SYS LTD COM 
AGRIW,AGRIFORCE GROWING SYS LTD WT S
AGRPY,ABSA GROUP LTD (SOUTH AFRICA) 
AGRX,AGILE THERAPEUTICS INC COM STK
AGS,PLAYAGS INC
AGSO,AGRISOLAR SOLUTIONS INC COM ST
AGTC,APPLIED GENETIC TECHNOLOGIES C
AGUNF,ARCTIC GLACRER INCOME FUND TR 
AGX,ARGAN INC
AGYP,ALLIED ENERGY CORPORATION. COM
AGYS,AGILYSYS INC.
AGZ,ISHARES AGENCY BOND ETF
AGZD,WISDOM TREE INTEREST RATE HEDG
AHAC,ALPHA HEALTHCARE ACQUISITION
AHACW,ALPHA HEALTHCARE ACQUISITION W
AHC,A H BELO CORP CL A COM STK (DE
AHCHY,Anhui Conch Cement Unsponsored
AHCO,ADAPTHEALTH CORP CL A
AHELF,AMERICAN HELIUM INC COM NEW (C
AHEXY,ADECCO GROUP AG AMERICAN DEPOS
AHFCF,FLOW CAP CORP COM NEW (CAN)
AHH,"ARMADA HOFFLER PROPERTIES, INC"
AHHPRA,ARMADA HOFFLER PPTYS INC PFD S
AHKSY,ASAHI KASEI CORPORATION ADR
AHLPRC,ASPEN INSURANCE HLDGS LTD FXD/
AHLPRD,ASPEN INSURANCE HOLDINGS LIMIT
AHLPRE,ASPEN INSURANCE HOLD LIM DEP S
AHPI,ALLIED HEALTHCARE PRODS INC CO
AHT,ASHFORD HOSPITALITY TR INC
AHTPRD,ASHFORD HOSPITALITY TR INC. 8.
AHTPRF,ASHFORD HOSPITALITY TR INC PFD
AHTPRG,ASHFORD HOSPITALITY TR INC CUM
AHTPRH,ASHFORD HOSPITALITY TR INC CUM
AHTPRI,ASHFORD HOSPITALITY TR INC PFD
AI,C3 AI INC CL A (DE)
AIA,ISHARES S&P ASIA 50 ETF
AIAGY,AURUBIS AG UNSPONSORED ADR (GE
AIBGY,AIB GROUP PLC (IRELAND)
AIEQ,ETF MANAGERS TR AI POWERED EQU
AIF,APOLLO TACTICAL INCOME FD INC 
AIG,AMERICAN INTL GROUP INC COM ST
AIGPRA,AMERICAN INTL GROUP INC DEP SH
AIH,AESTHETIC MED INTL HLDGS GROUP
AIHS,SENMIAO TECHNOLOGY LTD COM
AIIQ,ETF SER SOLUTIONS AI POWERED I
AIKI,AIKIDO PHARMA INC
AILQF,"AIRLQ, INC. ORDINARY SHARES (C"
AIM,AIM IMMUNOTECH INC COM
AIMC,ALTRA INDUSTRIAL MOTION CORP C
AIMD,AINOS INC COM (TX)
AIMLF,AI / ML INNOVATIONS INC COM (C
AIN,ALBANY INTL CORP CL A
AINC,ASHFORD INC COM STK (NV)
AINV,APOLLO INVT CORP COM NEW
AIO,VIRTUS ALLIANZGI ARTIFICIAL IN
AIQ,GLOBAL X FUNDS GLOBAL X ARTIFI
AIQUY,AIR LIQUIDE ADR
AIRC,APARTMENT INCOME REIT CORP COM
AIRG,AIRGAIN INC COM
AIRI,AIR INDUSTRIES GROUP COM STK (
AIRR,FIRST TR VI RBA AMERN INDL REN
AIRT,AIR T INC
AIRTP,AIR T FDG 8% ALPHA INCOME TR P
AISSF,AIS RES LTD COM (BHS)
AISSFXXXX,AIS RES LTD COM (BHS)
AITX,ARTIFICIAL INTELLIGENCE
AIV,APARTMENT INVST & MGMT CO CL A
AIZ,ASSURANT INC
AIZN,ASSURANT INC SUB NT 5.25% SUBO
AJAX,AJAX I ORD SHS CL A (CYM)
AJAXWS,AJAX I WT EXP (CYM)
AJG,GALLAGHER ARTHUR J.& CO
AJINY,AJINOMOTO INC ADR
AJRD,AEROJET ROCKETDYNE HLDGS INC C
AJXA,GREAT AJAX CORP SR CONV NT
AKAM,AKAMAI TECHNOLOGIES INC
AKBA,AKEBIA THERAPEUTICS INC COM
AKICW,SPORTS VENTURES ACQUISITION CO
AKOB,EMBOTELLADORA ANDINA S.A. S-B 
AKR,ACADIA REALTY TRUST
AKRO,AKERO THERAPEUTICS INC COM
AKTAF,AKITA DRILLING LTD CL-A N-VTG 
AKTS,AKOUSTIS TECHNOLOGIES INC
AKTX,AKARI THERAPEUTICS PLC SPONSOR
AKUS,AKOUOS INC COM
AKYA,AKOYA BIOSCIENCES INC COM (DE)
AKZOY,AKZO NOBEL N V SPON ADR NEW (N
AL,AIR LEASE CORP CL A
ALAC,ALBERTON ACQCORP USD ORD SHS
ALACW,ALBERTON ACQUISITION CORP WT 0
ALB,ALBEMARLE CORP
ALBBY,ALIBABA HEALTH INFORMATION TEC
ALBKY,ALPHA SERVICES AND HOLDINGS SA
ALC,ALCON INC. ORDINARY SHARES (CH
ALCC,ALTC ACQUISITION CORP CL A (DE
ALCO,ALICO INC
ALDS,APPLIFE DIGITAL SOLUTIONS INC 
ALDX,"ALDEYRA THERAPEUTICS, INC. COM"
ALE,ALLETE INC NEW
ALEAF,ALEAFIA HEALTH INC (CANADA)
ALEC,ALECTOR INC COM (DE)
ALEX,"ALEXANDER & BALDWIN, INC COM"
ALF,ALFI INC
ALFIW,ALFI INC WT EXP 04/29/26 CL A 
ALFVY,Alfa-Laval Ab Unsponsored ADR 
ALG,ALAMO GROUP
ALGM,ALLEGRO MICROSYSTEMS INC DEL C
ALGN,ALIGN TECHNOLOGY INC
ALGS,ALIGOS THERAPEUTICS INC COM (D
ALGT,ALLEGIANT TRAVEL COMPANY COM
ALHC,ALIGNMENT HEALTHCARE INC COM
ALID,ALLIED CORP
ALINPRA,ALTERA INFRASTRUCTURE LP 7.25%
ALINPRB,ALTERA INFRASTRUCTURE LP 8.50%
ALINPRE,ALTERA INFRASTRUCTURE LP 8.875
ALIT,ALIGHT INC. CL A (DE)
ALITWS,ALIGHT INC WT EXP
ALIZY,ALLIANZ SE
ALJJ,"ALJ Regional Holdings, Inc. Co"
ALK,ALASKA AIR GROUP INC
ALKM,ALKAME HOLDINGS INC COM STK (N
ALKS,ALKERMES PLC ORDINARY SHS (IRE
ALKT,ALKAMI TECHNOLOGY INC COM
ALL,ALLSTATE CORP (THE)
ALLE,ALLEGION PUB LTD CO (IRL)
ALLIF,ALPHA LITHIUM CORP (CANADA)
ALLK,ALLAKOS INC COM (DE)
ALLO,ALLOGENE THERAPEUTICS INC
ALLPRB,ALLSTATE CORP SUB DEB FIXED TO
ALLPRH,ALLSTATE CORP DEPOSITARY SHS R
ALLT,ALLOT LTD ORD SHS
ALLXF,ARIS GOLD CORP (CANADA)
ALLY,ALLY FINANCIAL INC COM STK
ALLYPRA,GMAC CAP TR I GTD TR PFD SECS 
ALMTF,ALMONTY INDUSTRIES INC ORD SHS
ALNA,ALLENA PHARMACEUTICALS COM
ALNY,ALYNLAM PHARMACEUTICALS INC
ALPMY,Astellas Pharma Inc Unsponsore
ALPN,ALPINE IMMUNE SCIENCES INC
ALPP,"ALPINE 4 HOLDINGS, INC. COMMON"
ALPPRQ,ALABAMA PWR CO PFD CL A %
ALRM,ALARM COM HLDGS INC COM
ALSK,ALASKA COMMUN SYS GRP INC
ALSMY,Alstom Unsponsored ADR (France
ALSN,ALLISON TRANSMISSION HLDGS INC
ALST,ALLSTAR HEALTH BRANDS INC
ALT,ALTIMMUNE INC COM NEW
ALTA,ALTABANCORP
ALTD,ALTITUDE INTL INC
ALTG,ALTA EQUIPMENT GROUP INC (DE) 
ALTGPRA,ALTA EQUIP GROUP INC DEP SHS R
ALTL,PACER LUNT LARGE CAP ALTENATOR
ALTO,ALTO INGREDIENTS INC COM (DE) 
ALTR,ALTAIR ENGR INC CL A COM
ALTS,PROSHARES TR MORNINGSTAR ALTER
ALTUW,ALTITUDE ACQUISITION CORP WT E
ALTY,GLOBAL X FDS SUPERDIVIDEND ALT
ALUS,ALUSSA ENERGY ACQUISITION CORP
ALUSWS,ALUSSA ENERGY ACQUISITION CORP
ALV,AUTOLIV INC
ALVOF,ALVOPETRO ENERGY LTD COMMON SH
ALVR,ALLOVIR INC
ALVRQ,ALVARION LTD ORDINARY SHARES
ALXN,ALEXION PHARMACEUTICALS INC
ALXO,ALX ONCOLOGY HLDGS INC
ALYA,ALITHYA GROUP INC CL A SUB VTG
ALZN,ALZAMEND NEURO INC COM NEW (DE
AM,ANTERO MIDSTREAM CORP COM
AMADY,AMADEUS IT GROUP SA ADS UNSPON
AMAM,AMBRX BIOPHARMA INC SPONSORED 
AMAO,AMERICAN ACQUISITION OPPORTUNI
AMAOW,AMERICAN ACQUISITION OPPORTUNI
AMAT,APPLIED MATERIALS INC
AMAZ,AMAZING ENERGY OIL & GAS CO CO
AMBA,"AMBARELLA, INC ORD SHS"
AMBBY,AMBU A/S ADR (DNK)
AMBC,AMBAC FINL GROUP INC NEW COM S
AMBCWS,AMBAC FINL GROUP INC WTS EXP 4
AMBO,AMBOW ED HLDG LTD
AMBZ,AMERICAN BUSINESS BANK LA CAL 
AMC,AMC ENTMT HLDGS INC CL A COM S
AMCA,ISHARES TR RUSSELL 1000 PURE U
AMCR,AMCOR PLC ORD USD0.01 (JEY)
AMCT,AMERICAN ED CTR INC
AMCX,AMC NETWORKS INC CLASS A COM
AMD,ADVANCED MICRO DEVICES
AME,AMETEK INC NEW
AMED,AMEDISYS INC
AMEH,APOLLO MED HLDGS INC
AMEN,AMEN PROPERTIES INC COMMON STO
AMER,EMLES TR MADE IN AMERICA ETF
AMFL,"AMERICAN FILMS, INC. COMMON ST"
AMG,AFFILIATED MANAGERS GROUP INC 
AMGN,AMGEN INC
AMH,AMERICAN HOMES 4 RENT
AMHCW,AMPLITUDE HEALTHCARE ACQUISITI
AMHG,AMERGENT HOSPITALITY GROUP INC
AMHPRE,AMERICAN HOMES 4 RENT PERP CUM
AMHPRF,AMERICAN HOMES 4 REN
AMHPRG,AMERICAN HOMES 4 RENT
AMHPRH,AMERICAN HOMES 4 REN
AMIGY,"ADMIRAL GROUP PLC, CARDIFF UNS"
AMIH,AMERICAN INTERNATIONAL HOLDING
AMJ,JPMORGAN CHASE & CO ALERIAN ML
AMK,ASSETMARK FINL HLDGS INC COM (
AMKBY,A.P. MOLLER-MAERSK A/S UNSPONS
AMKR,AMKOR TECHNOLOGY INC
AMLH,AMERICAN LEISURE HLDGS INC
AMLM,"AMERICAN LITHIUM MINERALS, INC"
AMLP,ALPS ETF TR ALERIAN MLP ETF
AMMJ,AMERICAN CANNABIS COMP INC COM
AMMPF,AMMPOWER CORP (CANADA)
AMMX,AMERAMEX INTL INC COM NEW
AMN,AMN HEALTHCARE SERVICES
AMND,ETRACS ALERIAN MIDSTREAM ENERG
AMOM,QRAFT AI-ENHANCED U S LARGE CA
AMOT,ALLIED MOTION TECHNOLOGIES INC
AMOV,AMER MOVIL SAB DE CV SPONSORED
AMP,"AMERIPRISE FINANCIAL, INC. COM"
AMPE,AMPIO PHARMACEUTICALS INC COM 
AMPG,AMPLITECH GROUP INC. COM NEW
AMPGW,AMPLITECH GROUP INC WT EXP 01/
AMPH,AMPHASTAR PHARMACEUTICALS INC 
AMPIWS,ADVANCED MERGER PARTNERS INC W
AMPY,AMPLIFY ENERGY CORP NEW COM (D
AMR,ALPHA METALLURGICAL RES INC CO
AMRC,"AMERESCO, INC. CL A COM STK"
AMRN,AMARIN CORP PLC SPONSORED ADR 
AMRS,AMYRIS INC COM NEW
AMRX,AMNEAL PHARMACEUTICALS INC CL 
AMS,AMERICAN SHARED HOSPITAL
AMSC,AMERICAN SUPERCONDUCTOR CORP S
AMSSY,AMS AG ADR
AMST,AMESITE INC NEW
AMSWA,AMER SOFTWARE INC CL-A
AMT,AMERICAN TOWER CORP REIT (DE) 
AMTB,AMERANT BANCORP INC CL A
AMTBB,AMERANT BANCORP INC CL B
AMTI,APPLIED MOLECULAR TRANS INC CO
AMTR,UBS AG LON BRH ETRACS ALERIAN 
AMTX,AEMETIS INC NEW COM STK (NV)
AMWL,AMERICAN WELL CORP COM CL A
AMX,"AMERICA MOVIL, S.A.B. DE C.V. "
AMXEF,AMEX EXPL INC (CANADA)
AMYT,AMRYT PHARMA PLC SPONSORED ADR
AMZA,ETFIS SER TR I
AMZN,AMAZON COM INC;COM USD0.01
AN,AUTONATION INC
ANAB,ANAPTYSBIO INC COM STK (DE)
ANACU,ARCTOS NORTHSTAR ACQUISIT CORP
ANACWS,ARCTOS NORTHSTAR ACQUISITION C
ANAT,AMERICAN NATL GROUP INC
ANCUF,ALIMENTATION COUCHE TRAD INC S
ANDA,ANDINA ACQUISITION CORP III US
ANDAR,ANDINA ACQUISITION CORP III RT
ANDAW,ANDINA ACQUISITION CORP III
ANDC,ANDOVER BANCORP INC (OH)
ANDE,ANDERSONS INC (THE)
ANEB,ANEBULO PHARMACEUTICALS INC CO
ANET,ARISTA NETWORKS INC COM
ANF,ABERCROMBIE & FITCH CO CL-A
ANGI,ANGI INC. CLASS A COMMON STOCK
ANGL,VANECK VECTORS ETF TR FALLEN A
ANGPY,ANGLO AMERN PLATINUM (SOUTH AF
ANIK,ANIKA THERAPEUTICS INC
ANIP,ANI PHARMACEUTICALS INC
ANIX,"ANIXA BIOSCIENCES, INC. COMMON"
ANLDF,ANFIELD ENERGY INC (CANADA)
ANNX,ANNEXON INC COM
ANPC,ANPAC BIO-MED SCIENCE CO LTD
ANSLY,ANSELL LTD SPON ADR (AUSTRIALI
ANSS,ANSYS INC
ANTE,AIRNET TECHNOLOGY INC SPONSORE
ANTGF,ADVANTAGEWON OIL COR (CANADA) 
ANTM,ANTHEM INC COM STK (IN)
ANVS,ANNOVIS BIO INC COM (DE)
ANXGF,ANACONDA MNG INC (CANADA)
ANY,SPHERE 3D CORP NEW COM SHS (CD
ANYYY,AENA SME S.A. AMERICAN DEPOSIT
ANZBY,AUSTRALIA & NW ZEAL ADS(RP5 SH
ANZU,ANZU SPL ACQUISITION CORP I CO
ANZUU,ANZU SPL ACQUISITION CORP I UN
ANZUW,ANZU SPL ACQUISITION CORP I WT
AOA,ISHARES TR CORE AGGRESSIVE ALL
AOD,ABERDEEN TOTAL DYNAMIC DIVID F
AOIFF,AFRICA OIL CORP ORD SHS (CANAD
AOK,ISHARES TR CORE CONSERVATIVE A
AOM,ISHARES TR CORE MODERATE ALLOC
AOMR,ANGEL OAK MTG INC COM
AON,AON PLC ORD SHS CL A NEW (IRL)
AONE,ONE CL A
AONEWS,ONE WT EXP 08/17/25
AOR,ISHARES TR CORE GROWTH ALLOCAT
AOS,SMITH A O CORP
AOTVF,ASCOT RESOURCES LTD (F)
AOUT,AMERICAN OUTDOOR BRANDS INC
AOXY,ADVANCED OXYGEN TECHNOLOGIES I
AP,AMPCO PITTSBURGH CORP
APA,APA CORP
APAM,ARTISAN PARTNERS ASSET MGMT IN
APD,AIR PROD&CHEM INC
APEI,AMERICAN PUB ED INC COM STK (D
APGB,APOLLO STRATEGIC GROWTH CAP II
APGBWS,APOLLO STRATEGIC GROWTH CAP II
APGOF,APOLLO GOLD & SILVER CORP
APH,AMPHENOL CORP (NEW) CL-A
API,AGORA INC ADS
APLD,APPLIED BLOCKCHAIN INC COM (NV
APLE,APPLE HOSPITALITY REIT INC COM
APLIF,APPILI THERAPEUTICS INC CL A (
APLS,APELLIS PHARMACEUTICALS INC CO
APLT,APPLIED THERAPEUTICS INC COM (
APM,APTORUM GROUP LTD USD CL A ORD
APMCF,MORIEN RES CORP (CANADA)
APO,APOLLO GLOBAL MGMT INC
APOP,CELLECT BIOTECHNOLOGY LTD SPON
APOPRB,APOLLO GLOBAL MGMT INC 6.375% 
APOPW,CELLECT BIOTECHNOLOGY LTD WT P
APP,APPLOVIN CORP COM CL A (DE)
APPF,APPFOLIO INC COM CL A
APPH,APPHARVEST INC
APPHW,APPHARVEST INC WT EXP 01/30/26
APPN,APPIAN CORP CL A
APPS,DIGITAL TURBINE INC COM NEW
APRE,APREA THERAPEUTICS INC
APRN,BLUE APRON HLDGS INC CL A NEW 
APRZ,LISTED FDS TR TRUESHARES STRUC
APSG,APOLLO STRATEGIC GROWTH CAP SH
APSGWS,APOLLO STRATEGIC GROWTH CAP WT
APT,"ALPHA PRO TECH,LTD"
APTL,ALASKA PWR & TELEPHONE CO
APTS,PREFERRED APT CMNTYS INC
APTV,APTIV PLC SHS (JEY)
APTVPRA,APTIV PLC MANDATORY PFD CONV S
APTX,APTINYX INC COM (DE)
APVO,APTEVO THERAPEUTICS INC COM NE
APVS,APPLIED VISUAL SCIENCES INC CO
APWC,ASIA PACIFIC WIRE & CABLE CORP
APWS,AMPCO-PITTSBURGH CORP WT EXP S
APXT,APEX TECHNOLOGY ACQUISITION CO
APXTU,APEX TECH ACQU CORP UNIT 1 COM
APXTW,APEX TECHNOLOGY ACQUISITION CO
APYP,"APPYEA, INC. COMMON STOCK"
AQARF,AQUILA RESOURCES INC ORDINARY 
AQB,AQUABOUNTY TECHNOLOGIES INC CO
AQMS,AQUA METALS INC COM STK (DE)
AQN,ALGONQUIN POWER ORDINARY SHARE
AQNA,ALGONQUIN PWR & UTILS CORP
AQNB,ALGONQUIN PWR & UTILS CORP 201
AQNU,ALGONQUIN PWR & UTILS CORP
AQSP,ACQUIRED SALES CORP. COMMON ST
AQST,AQUESTIVE THERAPEUTICS INC COM
AQUA,EVOQUA WATER TECHNOLOGIES CORP
AQWA,GLOBAL X FDS CLEAN WATER ETF (
AR,ANTERO RESOURCES CORPORATION C
ARAV,VERSARTIS INC COM
ARAY,ACCURAY INCORPORATED COM STK
ARB,ALTSHARES TR MERGER ARBITRAGE 
ARBG,AEQUI ACQUISITION CORP CL A
ARBGU,AEQUI ACQUISITION CORP UNIT 1 
ARBGW,AEQUI ACQUISITION CORP WT EXP 
ARC,ARC DOCUMENT SOLUTIONS INC COM
ARCB,ARCBEST CORPORATION COMMON STO
ARCC,ARES CAPITAL CORP
ARCE,ARCO PLATFORM LTD CL A COM (CY
ARCH,"ARCH RESOURCES, INC"
ARCM,ARROW INVTS TR ARROW RESV CAP 
ARCO,ARCOS DORADOS HOLDINGDS INC. C
ARCT,ARCTURUS THERAPEUTICS HLDGS IN
ARD,ARDAGH GROUP S A CL A
ARDC,ARES DYNAMIC CR ALLOCATION FD 
ARDS,ARIDIS PHARMACEUTICALS INC COM
ARDX,ARDELYX INC COM STK (DE)
ARE,ALEXANDRIA REAL EST EQ INC
AREB,AMERICAN REBEL HLDGS
AREC,AMERICAN RES CORP COM NEW
ARES,ARES MGMT CORP COM CL A (DE)
ARFXF,PROMIS NEUROSCIENCES INC COM S
ARGD,ARGO GROUP US INC GTD SR NT 6.
ARGGY,ASTON MARTIN LAGONDA GLOBAL
ARGO,ARGO GROUP INTERNATIONAL HOLDI
ARGOPRA,ARGO GROUP INTL HLD LTD
ARGQ,ARGENTUM 47 INC COM STK (NV)
ARGT,GLOBAL X MSCI ARGENTINA ETF
ARGX,ARGENX SE SPONSORED ADS (NLD) 
ARHTF,ARHT MEDIA INC (CANADA)
ARI,APOLLO COMMERICAL REAL ESTATE 
ARKAY,ARKEMA SPONSORED ADR (FRANCE) 
ARKF,ARK ETF TR FINTECH INNOVATION 
ARKG,ARK GENOMIC REVOLUTION ETF (DE
ARKK,ARK ETF TR INNOVATION ETF (DE)
ARKO,ARKO CORP
ARKOW,ARKO CORP WT EXP 12/22/2025
ARKQ,ARK AUTONOMOUS TECHNOLOGY & RO
ARKR,ARK RESTAURANTS CORP
ARKW,ARK NEXT GENERATION INTERNET E
ARKX,ARK ETF TR ARK SPACE EXPL & IN
ARL,AMER REALTY INVESTORS INC(NEW)
ARLO,ARLO TECHNOLOGIES INC
ARLP,ALLIANCE RESOURCES PART L.P.
ARMK,ARAMARK COM STK
ARMP,ARMATA PHARMACEUTICALS INC COM
ARMR,EXCHANGE LISTED FDS TR ARMOR U
ARNA,ARENA PHARMACEUTICALS INC COM 
ARNC,ARCONIC ROLLED PRODS CORP COM 
ARNGF,ARGONAUT GOLD LTD ORD SHS (CDA
AROC,ARCHROCK INC
AROW,ARROW FINANCIAL CORP
ARPO,AERPIO PHARMACEUTICALS INC COM
ARQT,ARCUTIS BIOTHERAPEUTICS INC CO
ARR,ARMOUR RESIDENTIAL REIT INC CO
ARREF,AMERIGO RESOURCES LTD
ARRPRC,ARMOUR RESIDENTIAL REIT INC
ARRW,ARROWROOT ACQUISITION CORP CL 
ARRWU,ARROWROOT ACQUIS CORP UNIT 1 C
ARRWW,ARROWROOT ACQUISITION CORP WT 
ARRY,ARRAY TECHNOLOGIES INC COM (DE
ARSMF,ARES STRATEGIC MNG INC COM (CA
ARSN,AUREUS INC COM NEW
ARTAU,ARTISAN ACQUISITION CORP UN 1 
ARTL,ARTELO BIOSCIENCES INC CO NEW 
ARTW,ARTS WAY MFG INC
ARVL,ARRIVAL GROUP COM (LUX)
ARVN,ARVINAS INC COM
ARW,ARROW ELECTRONICS INC
ARZTY,"ARYZTA AG, ZUERICH UNSPONSORED"
ASA,ASA GOLD AND PRECIOUS METALS L
ASAI,SENDAS DISTRIBUIDORA S A
ASAN,"ASANA, INC CL A (DE)"
ASAQ,ATLANTIC AVE ACQUISITION CORP 
ASAQWS,ATLANTIC AVE ACQUISITION CORP 
ASAXW,ASTREA ACQUISITION CORP WT EXP
ASAZY,Assa Abloy AB Unsponsored ADR 
ASB,ASSOCIATED BANC CORP
ASBFY,ASSOCIATED BRITISH FD PLC ADR 
ASBPRD,ASSOCIATED BANC-CORP WIS DS RE
ASBPRE,ASSOCIATED BANC-CORP DEP SH RE
ASC,ARDMORE SHIPPING CORP COM MARS
ASCC,ARISTOCRAT GROUP CORP COM (NEW
ASCCY,ASICS CORPORATION AMERICAN DEP
ASDN,ASTRO AEROSPACE LTD COM NEW
ASEA,GLOBAL X FUNDS GLOBAL X FTSE S
ASEKY,AISIN CORPORATION AMERICAN DEP
ASET,FLEXSHARES TR REAL ASSETS ALLO
ASG,LIBERTY ALL-STAR GROWTH FD INC
ASGI,ABERDEEN STD GLOBAL INFRASTRUC
ASGLY,AGC INC (JAPAN)
ASGN,ASGN INC COM
ASH,ASHLAND GLOBAL HLDGS INC COM (
ASHR,XTRACKERS HARVEST CSI 300 CHIN
ASHS,XTRACKERS HARVEST CSI 500 CHIN
ASHTY,ASHTED GROUP PLC UNSPON ADR (U
ASHX,DBX ETF TR XTRACKERS MCSI CHIN
ASIX,ADVANSIX INC COM (DE)
ASLE,AERSALE CORP
ASLEW,AERSALE CORP WT EXP 11/04/2025
ASLN,ASLAN PHARMACEUTICALS LTD ADS 
ASM,AVINO SILVER & GOLD MINES LTD 
ASMB,ASSEMBLY BIOSCIENCES INC COM
ASMIY,ASM INTERNATL N.V
ASML,ASML HOLDING NV NY REG SHS NEW
ASMVY,Asm Pacific Technology Ltd Uns
