SYMBOL,DESCRIPTION
PSBPRW,PS BUSINESS PKS INC CALIF DS R
PSBPRX,PS BUSINESS PKS INC
PSBPRY,PS BUSINESS PKS INC
PSBPRZ,PS BUSINESS PKS INC CALIF DEP 
PSBQ,PSB HLDGS INC
PSC,PRINCIPAL ETF U.S. SMALL-CAP M
PSCC,INVESCO S&P SMALLCAP CONSUMER 
PSCE,INVESCO S&P SMALLCAP ENERGY ET
PSCF,INVESCO S&P SMALLCAP FINANCIAL
PSCH,INVESCO S&P SMALLCAP HEALTH CA
PSCM,INVESCO S&P SMALLCAP MATERIALS
PSCT,INVESCO S&P SMALLCAP INFORMATI
PSCU,INVESCO FD TR II S&P SMALLCAP 
PSCW,PACER FDS TR SWAN SOS CONSERVA
PSCX,PACER FDS TR SWAN SOS CONSERVA
PSEC,PROSPECT CAPITAL CORP COM STK 
PSEP,INNOVATOR ETFS TR S&P 500 PWR 
PSET,PRINCIPAL EXCHANGE-TRADED FUND
PSF,COHEN & STEERS SELECT PFD & IN
PSFE,PAYSAFE LTD SHS (BMU)
PSFF,PACER FDS TR SWAN SOS FD OF FD
PSFJ,PACER FDS TR SWAN SOS FLEX JUL
PSFM,PACER FDS TR SWAN SOS FLEX APR
PSGTY,PT SEMEN INDONESIA (PERSERO) T
PSHG,PERFORMANCE SHIPPING INC COM N
PSI,INVESCO EXCHANGE-TRADED FD TR 
PSJ,INVESCO EXCHANGE-TRADED FD TR 
PSK,SPDR SER TR SPDR ICE PFD SEC E
PSL,INVESCO DWA CONSUMER STAPLES M
PSLV,SPROTT PHYSICAL SILVER TR UIT 
PSMB,INVESCO ACT MNG ETF TR BAL MUL
PSMC,INVESCO ACT MNG ETF TR CONSERV
PSMD,PACER FDS TR SWAN SOS MODERATE
PSMG,INVESCO ACTIVELY MANAGED ETF T
PSMJ,PACER FDS TR SWAN SOS MODERATE
PSMM,INVESCO ACT MNG ETF TR MODERAT
PSMMY,Persimmon Plc Unsponsored ADR 
PSMR,PACER FDS TR SWAN SOS MODERATE
PSMT,PRICESMART INC
PSN,PARSONS CORP DEL
PSO,PEARSON PLC ADR(RP 1ORD25PEN) 
PSP,INVESCO EXCHANGE-TRADED FD TR 
PSPCU,POST HLDGS PARTN CORP UNT 1 CO
PSPW,3POWER ENERGY GRP INC COM STK 
PSQ,PROSHARES SHORT QQQ
PSR,INVESCO ACTIVELY
PSSR,"PASSUR AEROSPACE, INC. COMMON "
PST,PROSHARES ULTRASHORT LEHMAN 7-
PSTG,PURE STORAGE INC CL A COMT STK
PSTH,PERSHING SQUARE TONTINE HOLDIN
PSTHWS,PERSHING SQUARE TONTINE HOLDIN
PSTI,"PLURISTEM THERAPEUTICS, INC. C"
PSTL,POSTAL RLTY TR INC CL A (MD)
PSTV,PLUS THERAPEUTICS INC COM NEW 
PSTVY,POSTAL SVGS BK OF CHINA LTD AD
PSTX,POSEIDA THERAPEUTICS INC
PSUD,PETROSUN INC COMMON STOCK
PSWW,PRINCIPAL SOLAR INC COM NEW
PSX,PHILLIPS 66 COMMON STOCK
PSXP,PHILLIPS 66 PARTNERS LP COM UN
PSY,ETF SER SOLUTIONS DEFIANCE NEX
PSYTF,PASON SYSTEMS INC (F)
PT,PINTEC TECHNOLOGY HLDGS LTD SP
PTA,COHEN & STEERS TAX-ADVANTAGED 
PTAIY,Pt Astra International TBK Uns
PTALF,PETROTAL CORP (CANADA)
PTAM,"POTASH AMERICA, INC. COMMON ST"
PTBD,PACER FDS TR TRENDPILOT U S BO
PTBS,POTOMAC BANCSHARES INC
PTC,PTC INC COM STK
PTCT,PTC THERAPEUTICS INC COM STK (
PTE,POLARITYTE INC COM (DE)
PTEN,PATTERSON-UTI ENERGY INC
PTF,INVESCO EXCHANGE-TRADED FD TR 
PTGX,PROTAGONIST THERAPEUTICS INC C
PTH,INVESCO EXCHANGE-TRADED FD TR 
PTIC,PROPTECH INVT CORP II CL A
PTICW,PROPTECH INVT CORP II WT EXP
PTIN,PACER FDS TR TRENDPILOT INTL E
PTIX,PROTAGENIC THERAPEUTICS INC CO
PTIXW,PROTAGENIC THERAPEUTICS INC WT
PTJSY,PT JASA MARGA (PERSERO) TBK UN
PTKWS,PTK ACQUISITION CORP WT EXP (D
PTLC,PACER FDS TR TRENDPILOT US LAR
PTMC,PACER FDS TR TRENDPILOT US MID
PTMN,PORTMAN RIDGE FIN CORP COM (DE
PTN,PALATIN TECHNOLOGIES INC NEW C
PTNQ,PACER FDS TR TRENDPLIOT 100 ET
PTNYF,PARCELPAL LOGISTICS INC COM (C
PTOC,PINE TECHNOLOGY ACQUISITION CO
PTOCW,PINE TECHNOLOGY ACQUISITION CO
PTOI,"PLASTIC2OIL, INC."
PTON,PELOTON INTERACTIVE INC CL A C
PTOP,PEER TO PEER NETWORK COMMON ST
PTOTF,PATRIOT ONE TECHNOLOGIES INC C
PTPI,PETROS PHARMACEUTICALS INC COM
PTR,PETROCHINA CO LTD ADS(RP100 H 
PTRA,PROTERRA INC COM (DE)
PTRAW,PROTERRA INC WT EXP 09/22/27 (
PTRS,PARTNERS BANCORP COM
PTRUF,PETRUS RES LTD NEW COM (CDA)
PTXKY,PT XL AXIATA TBK ADR (INDONESI
PTY,PIMCO CORPORATE & INCOME
PUBC,PUREBASE CORP
PUBGY,PUBLICIS SA ADS (1 ADS = 1C0M)
PUBM,PUBMATIC INC CL A COM
PUCCF,PANCONTINENTAL RES CORP COM(CA
PUCK,GOAL ACQUISITIONS CORP COM
PUCKW,GOAL ACQUISITIONS CORP WT EXP 
PUK,PRUDENTIAL PLC ADS (REP 2 ORD)
PUKPR,PRUDENTIAL PLC PERPETUAL SUB C
PULM,PULMATRIX INC COM NEW (DE)
PULS,PGIM ETF TR
PUMP,PROPETRO HOLDING CORP.
PUPS,PICK-UPS PLUS INC
PURXF,PURE EXTRACTION CORP (CANADA) 
PUTW,WISDOMTREE TR CBOE S&P 500 PUT
PUYI,PUYI INC ADS (CYM)
PV,PRIMAVERA CAP ACQUISITION CORP
PVAC,PENN VA CORP NEW COM STK (VA) 
PVAL,PUTNAM ETF TR PUTNAM FOCUSED L
PVBC,PROVIDENT BANCORP INC COM STK 
PVCT,"PROVECTUS BIOPHARMACEUTICALS, "
PVG,PRETIUM RES INC
PVGDF,PROVENANCE GOLD CORP (CANADA) 
PVH,PVH CORP COM STK (DE)
PVI,INVESCO VRDO TAX-FREE ETF
PVL,PERMIANVILLE RTY TR TR UNIT (D
PVWS,PRIMAVERA CAP ACQUISITION CORP
PW,POWER REIT COM SHS OF BENEFICI
PWC,INVESCO EXCHANGE-TRADED FD TR 
PWCDF,POWER CORP CANADA
PWFL,POWERFLEET INC
PWLK,POWERLOCK INTL CORP COM
PWOD,PENNS WOODS BANCORP INC
PWP,PERELLA WEINBERG PARTNERS CL A
PWPPW,PERELLA WEINBERG PARTNERS WT E
PWR,QUANTA SERVICES INC
PWS,PACER FDS TR WEALTHSHIELD ETF 
PWV,INVESCO EXCHANGE-TRADED FD TR 
PWWBF,POWERBRAND SOLUTIONS INC COM N
PWZ,INVESCO CALIFORNIA AMT-FREE MU
PXD,PIONEER NAT RES CO
PXE,INVESCO EXCHANGE-TRADED FD TR 
PXF,INVESCO IFTSE RAFI DEV MKTS EX
PXH,INVESCO ETF TR II FTSE RAFI EM
PXI,INVESCO EXCHANGE-TRADED FD TR 
PXJ,INVESCO EXCHANGE-TRADED FD TR 
PXLW,PIXELWORKS INC COM NEW
PXQ,INVESCO EXCHANGE-TRADED FD TR 
PXS,PYXIS TANKERS INC COM
PXSAP,PYXIS TANKERS INC SER A CUM CO
PXSAW,PYXIS TANKERS INC WT PUR COM E
PY,PRINCIPAL EXCHANGE-TRADED FUND
PYBX,HYDRO POWER TECHNOLOGIES INC C
PYN,PIMCO NEW YORK MUNICIPAL INCOM
PYPD,POLYPID LTD SHS NEW (ISR)
PYPE,UBS AG LONDON BR ETRACS
PYPL,PAYPAL HLDGS INC COM
PYR,PYROGENESIS CDA INC COM(CAN)
PYS,PPLUS TRUST SERIES RRD-1 TR CT
PYT,PPLUS TR GSC-2 TR CTF FLTG RAT
PYZ,INVESCO EXCHANGE-TRADED FD TR 
PZA,INVESCO ETF TR II NATL AMT-FRE
PZC,PIMCO CALIFORNIA MUNICIPAL INC
PZG,PARAMOUNT GOLD NEV CORP COM
PZN,"PZENA INVESTMENT MANAGEMENT, I"
PZOO,PAZOO INC
PZT,INVESCO ETF TR II N Y AMT -FRE
PZZA,PAPA JOHNS INTL INC
QABA,FIRST TRUST NASDAQ ABA COMMUNI
QADA,QAD INC CLA A COM STK
QADB,OAD INC CL B
QAI,IQ HEDGE MULTI-STRATEGY COMPOS
QARP,XTRACKERS RUSSELL 1000 US QUAL
QAT,ISHARES TR ISHARES MSCI QATAR 
QBCRF,QUEBECOR INC (CANADA)
QBIEY,QBE INSURANCE GRP LTD SPON ADR
QBIO,QBIOMED INC
QCCUF,QC COPPER & GOLD INC (CANADA) 
QCLN,FIRST TR NASDAQ CLEAN EDGE GRE
QCOM,QUALCOMM INC
QCON,AMERICAN CENTY ETF TR QUALITY 
QCRH,QCR HOLDINGS INC
QDEC,FIRST TR EX-TR FD VIII CBOE VE
QDEF,FLEXSHARES QUALITY DIV DEFENSI
QDEL,QUIDEL CORP
QDF,FLEXSHARES QUALITY DIVIDEND IN
QDIV,GLOBAL X FUNDS S&P 500 QUALITY
QDROF,QUADRO RES LTD COM NEW(CANADA)
QDYN,FLEXSHARES QUALITY DIVIDEND DY
QED,INDEXIQ ETF TRIQ HEDGE EVENT D
QEFA,SPDR INDEX SHS FDS MSCI EAFE S
QEGY,QUANTUM ENERGY INC COM STK
QELL,QELL ACQUISITION CORP CL A (CY
QELLW,QELL ACQUISITION CORP WT EXP 1
QEMM,SPDR INDEX SHS FDS MSCI EMERGI
QFIN,"360 DIGITECH, INC. AMERICAN DE"
QFTA,QUANTUM FINTECH ACQUISIT CORP 
QFTAU,QUANTUM FINTECH ACQUISIT CORP 
QFTAWS,QUANTUM FINTECH ACQUISITION CO
QGEN,QIAGEN NV
QGLDF,Q-GOLD RES LTD COM
QGRO,AMERICAN CENTY ETF TR STOXX US
QH,QUHUO LTD ADR
QHYG,QHY GROUP
QID,PROSHARES ULTRASHORT QQQ ETF N
QINT,AMERICAN CENTY ETF TR QUALITY 
QIPT,QUIPT HOME MED CORP COM (CAN) 
QIWI,QIWI PLC SPONSORED ADR REPSTG 
QJUN,FIRST TR EXCHANGE-TRADED FD VI
QLC,FLEXSHARES TR US QUALITY LARGE
QLD,PROSHARES ULTRA QQQ
QLGN,QUALIGEN THERAPEUTICS INC COM 
QLI,QILIAN INTL HLDG GROUP LTD USD
QLS,INDEXIQ ETF TR IQ HEDGE LONG/S
QLTA,ISHARES TRUST AAA-A RATED CORP
QLV,FLEXSHARES US QUALITY LOW VOLA
QLVD,FLEXSHARES DEV MKTS EX-US QTY 
QLVE,FLEXSHARES EMERGING MKTS QUALI
QLYS,QUALYS INC COM STK (DE)
QMAR,FIRST TR EX-TR VIII FT CBOE VE
QMCO,QUANTUM CORP COM NEW
QMEI,QUANTUM METAL EXCHANGE INC
QMJ,DIREXION SHS ETF TR S&P 500 HI
QMOM,ALPHA ARCHITECH U.S. QUANTITAT
QNBC,QNB CORP
QNST,"QUINNSTREET, INC COM STK (CANA"
QNTA,QUANTA INC
QPFF,AMERICAN CENTY ETF TR QUALITY 
QPTFF,QUEST PHARMATECH INC
QPX,ADVISORSHARES TR Q DYNAMIC GRO
QQC,SIMPLIFY ETF FUNDS SIMPLIFY NA
QQD,SIMPLIFY ETF SIMPLIFY NASDAQ 1
QQEW,FIRST TR NASDAQ 100 EQUAL WEIG
QQH,NORTHERN LTS FD TR III HCM DEF
QQQ,INVESCO QQQ TR
QQQA,PROSHARES TR NASDAQ 100 DORSEY
QQQE,DIREXION NASDAQ-100 EQUAL WEIG
QQQJ,INVESCO EXCHANGE-TRADED FD TR 
QQQM,INVESCO EXCHANGE-TRADED FD TR 
QQQN,VICTORY PORTFOLIOS II VICTORYS
QQQX,NUVEEN NASDAQ 100 DYNAMIC OVER
QRFT,QRAFT AI-ENHANCED U S LARGE CA
QRHC,QUEST RESOURCE HOLDING CORPORA
QRTEA,"QURATE RETAIL, INC. SERIES A C"
QRVO,QORVO INC COMMON STOCK
QS,QUANTUMSCAPE CORP COM CL A (DE
QSI,QUANTUM-SI INC
QSIAW,QUANTUM-SI INC
QSR,RESTAURANT BRANDS INTERNATIONA
QSWS,QUANTUMSCAPE CORP WT EXP
QSY,WISDOMTREE TR U.S QUALITY SHAR
QTAP,INNOVATOR ETFS TR GROWTH ACCEL
QTCI,QUANTUM CAP INC COM (NV)
QTEC,FIRST TRUST NASDAQ 100 TECHNOL
QTJL,INNOVATOR ETFS TR GROWTH ACCEL
QTNT,QUOTIENT LIMITED ORDINARY SHAR
QTRRF,QUATERRA RESOURCES INC LTD
QTRX,QUANTERIX CORP COM
QTS,QTS RLTY TR INC COM CL A (MD) 
QTSPRA,QTS RLTY TR INC PERP PFD SERIE
QTT,QUTOUTIAO INC ADS REPSTG CL A 
QTUM,ETF SER SOLUTIONS DEFIANCE QUA
QTWO,Q2 HLDGS INC COM STK (DE)
QUAD,"QUAD/GRAPHICS, INC CLASS A COM"
QUAL,ISHARES MSCI USA QUALITY FACTO
QUAN,QUANTUM INTERNATIONAL CORPORAT
QUBT,QUANTUM COMPUTING INC COM
QUGB,QUINTON GROUP INC
QUIK,QUICKLOGIC CORPORATION COM NEW
QULL,ETRACS 2X LEVERAGED US QUALITY
QUMU,QUMU CORP COM
QUOT,QUOTIENT TECHNOLOGY INC COM ST
QURE,UNIQURE N V ORD SHS (NLD)
QUS,SPDR SER TR MSCI USA STRATEGIC
QVAL,ALPHA ARCHITECT U.S. QUANTITAT
QVCC,QVC INC SR SECD NT DTD11/26/19
QVCD,QVC INC 6.375% SR SECD NT 9/13
QVML,INVESCO EXCHANGE-TRADED FD TR 
QVMM,INVESCO ETF TR II S&P MIDCAP 4
QVMS,INVESCO ETF TR II S&P SMALLCAP
QWLD,SPDR INDEX SHS FDS
QYBX,QIAN YUAN BAIXING INC COM
QYLD,GLOBAL X FDSNASDAQ 100 COVERED
QYLG,GLOBAL X FDS NASDAQ 100 COVERE
R,RYDER SYSTEM INC
RA,BROOKFIELD REAL ASSETS INCOME 
RAAC,REVOLUTION ACCELERATION ACQUIS
RAACU,REVOLUTION ACCELERATION ACQ CO
RAACW,REVOLUTION ACCELERATION ACQ CO
RAAS,CLOOPEN GROUP HLDG LTD ADS
RAAX,VANECK INFLATION ALLOCATION ET
RACE,FERRARI N V NEW COM SHS (NLD) 
RAD,RITE AID CORP COM PAR $1.00
RADA,RADA ELECTRONIC INDUSTRIES LTD
RADI,RADIUS GLOBAL INFRASTRUCTURE
RADIW,RADIUS GLOBAL INFRASTRUCTURE
RAFE,PIMCO EQUITY SER RAFI ESG U S 
RAIL,"FREIGHTCAR AMERICA, INC"
RAIN,RAIN THERAPEUTICS INC COM (DE)
RAKR,RAINMAKER WORLDWIDE INC COM
RALS,PROSHARES TR RAFI LONG/SHORT F
RAM,ARIES I ACQUISITION CORP CL A 
RAMMU,ARIES I ACQ CORP UNIT 1 CL A &
RAMMW,ARIES I ACQUISITION CORP WT EX
RAMP,LIVERAMP HLDGS INC COM (DE)
RAND,RAND CAPITAL CORP
RAPT,RAPT THERAPEUTICS INC COM
RARE,ULTRAGENYX PHARMACEUTICAL INC 
RATIY,RATIONAL AG AMERICAN DEP SHS (
RAVE,RAVE RESTAURANT GROUP INC
RAVN,RAVEN INDUSTRIES INC
RAYC,ADVISORS INNER CIRCLE III RAYL
RAYT,RAYONT INC COM
RBA,RITCHIE BROS.AUCTIONEERS INC
RBAC,REDBALL ACQUISITION CORP CL A 
RBACWS,REDBALL ACQUISITION CORP WT EX
RBB,RBB BANCORP COM
RBBN,RIBBON COMMUNICATIONS INC
RBC,REGAL BELOIT CORPORATION
RBCAA,REPUBLIC BANCORP INC CL A
RBGLY,RECKITT BENCKISER PLC SPONSORE
RBKB,RHINEBECK BANCORP INC COM STK 
RBLX,ROBLOX CORP COM CL A
RBNC,RELIANT BANCORP INC
RBND,SPDR SER TR BLOOMBERG SASB COR
RBSFY,RUBIS AMERICAN DEPOSITORY RECE
RBSY,ROBOSERVER SYSTEMS CORP
RC,READY CAP CORP COM
RCAR,RENOVACARE INC COM STK (NV)
RCAT,RED CAT HLDGS INC
RCB,READY CAP CORP SR NT (MD)
RCC,READY CAP CORP SR NT
RCD,INVESCO ETF TR S&P 500 EQUAL W
RCEL,AVITA THERAPEUTICS INC COM
RCG,RENN FD INC COM STK (TX)
RCGCF,ROSCAN GOLD CORP COM(CANADA)
RCHG,RECHARGE ACQUISITION CORP COM 
RCHGW,RECHARGE ACQUISITION CORP WT E
RCI,ROGERS COMMUNICATIONS INC CL-B
RCII,RENT-A-CENTER INC
RCKT,ROCKET PHARMACEUTICALS INC COM
RCKTF,ROCK TECH LITHIUM INC ORDINARY
RCKY,ROCKY BRANDS INC COM STK
RCL,ROYAL CARIBBEAN GROUP
RCLFU,ROSECLIFF ACQUISITION CORP I U
RCLFW,ROSECLIFF ACQUISITION CORP I W
RCM,R1 RCM INC
RCMT,RCM TECHNOLOGIES INC
RCON,"RECON TECHNOLOGY, LTD. CLASS A"
RCPRB,READY CAP CORP 8.625% PFD CONV
RCPRC,READY CAP CORP
RCPRD,READY CAP CORP
RCPRE,READY CAP CORP CUM RED PFD SER
RCRT,RECRUITER COM GROUP INC
RCRTW,RECRUITER COM GROUP INC WT PUR
RCRUY,RECRUIT HLDGS CO LTD (JAPAN)
RCS,PIMCO STRATEGIC GLOBAL INCOME 
RCUS,ARCUS BIOSCIENCES INC
RDAR,RAADR INC COM NEW
RDCM,RADCOM LTD ORD SHS
RDEIY,RED ELECTRICA CORPORATION SA U
RDEXF,RED PINE EXPL INC
RDFI,COLLABORATIVE INVT SER TR RARE
RDFN,REDFIN CORP COM
RDGMF,RIDGELINE MINERALS CORP (CANAD
RDHL,REDHILL BIOPHARMA LTD
RDI,READING INTL CL A
RDIB,READING INTL CL B
RDIV,INVESCO EXCHANGE-TRADED FD TR 
RDN,RADIAN GROUP INC
RDNT,"RadNet, Inc. Common Stock"
RDRUY,NEOMETALS LTD SPONSORED ADR (A
RDSA,ROYAL DUTCH SHELL PLC SPON ADR
RDSB,ROYAL DUTCH SHELL PLC ADS ( EA
RDSMY,ROYAL DSM NV SPONSORED ADR (NE
RDUFF,RADIUS GOLD INC
RDUS,RADIUS HEALTH INC COM STK
RDVA,RDVA INC
RDVT,RED VIOLET INC COM
RDVY,FIRST TRUST RISING DIVIDEND AC
RDWR,RADWARE LTD
RDY,DR. REDDY'S LABORATORIES ADS
RE,EVEREST RE GP LTD(BERM)HLDG CO
REAL,THE REALREAL INC COM
REAX,REAL BROKERAGE INC COM NEW(CAN
RECAF,RECONNAISSANCE ENERGY AFRICA L
REDU,RISE ED CAYMAN LTD SPONSRED AD
REEMF,RARE ELEMENT RES LTD
REET,ISHARES GLOBAL REIT ETF
REFG,MEDICAL CANNABIS PAYMENT SOLUT
REFR,RESEARCH FRONTIERS INC
REG,REGENCY CENTERS CORP
REGI,RENEWABLE ENERGY GROUP INC
REGL,PROSHARES TR S&P MIDCAP 400 DI
REGN,REGENERON PHARMACEUTICALS INC 
REGRF,GRAPH BLOCKCHAIN INC (CANADA) 
REI,"RING ENERGY, INC. COMMON STOCK"
REIT,ALPS ETF TR
REKR,REKOR SYS INC COM (DE)
RELI,"RELIANCE GLOBAL GROUP, INC. CO"
RELL,RICHARDSON ELECTRONICS LTD
RELT,RELIANT HLDGS INC M (NV)
RELV,RELIV INTL INC COM PAR $0.001 
RELX,RELX PLC SPONSORED ADR (NY)
REM,ISHARES TR MTG REAL ESTATE ETF
REML,CREDIT SUISSE XLINKS MONTHLY P
REMX,VANECK VECTORS ETF TR RARE EAR
RENN,RENREN INC SPONSORED ADR CL A 
REPH,RECRO PHARMA INC COM
REPL,REPLIMUNE GROUP INC COM (DE)
REPO,NATIONAL ASSET RECOVERY CORP C
REPX,RILEY EXPL PERMIAN INC COM
REPYY,REPSOL SA SPONSORED ADR
RERE,AIHUISHOU INTL CO LTD SPONSORE
RES,RPC INC
RESD,WISDOMTREE INTERNATIONAL ESG F
RESE,WISDOMTREE EMERGING MARKETS ES
RESN,RESONANT INC COM STK (DE)
RESP,WISDOMTREE U.S. ESG FUND (DE) 
RETA,REATA PHARMACEUTICALS INC CL A
RETL,DIREXION DAILY RETAIL BULL 3X 
RETO,RETO ECO-SOLUTIONS INC USD COM
REV,REVLON INC CL A COMMON
REVG,REV GROUP INC COM
REVHU,REVOLUTION HEALTHCARE ACQUISIT
REVS,COLUMBIA ETF TR I
REW,PROSHARES TR ULTRASHORT TECHNO
REX,REX AMERICAN RESOURCES CORPORA
REXR,REXFORD INDL RLTY INC. COM
REXRPRC,REXFORD INDIVIDUAL REALTY INC 
REYN,REYNOLDS CONSUMER PRODS INC
REZ,ISHARES TR RESIDENTIAL AND MUL
REZI,RESIDEO TECHNOLOGIES INC
REZZF,GLOBAL BATTERY METAL LTD ORD S
RF,REGIONS FINANCIAL CORP (NEW)
RFCI,ALPS ETF TR RIVERFRONT DYNAMIC
RFDA,ALPS ETF TR RIVERFRONT DYNAMIC
RFEM,FIRST TRUST III RIVERFRONT DYN
RFEU,FIRST TRUST ETF III RIVERFRONT
RFG,INVESCO EXCHANGE-TRADED FD TR 
RFI,COHEN&STEERS TOT RET REALTY FD
RFIL,RF INDUSTRIES LTD
RFL,RAFAEL HLDGS INC CL B
RFM,RIVERNORTH FLEXIBLE MUNICIPAL 
RFMZ,RIVERNORTH FLEXIBLE MUN INCOME
RFP,RESOLUTE FST PRODS INC
RFPRB,REGIONS FINL CORP NEW DEP SHS 
RFPRC,REGIONS FINL CORP NEW DEP SHS 
RFPRE,REGIONS FINL CORP NEW DEPOSITA
RFUN,ALPS ETF TR RIVERFRONT UNCONST
RFV,INVESCO EXCHANGE-TRADED FD TR 
RGA,"REINSURANCE GROUP OF AMERICA, "
RGBPP,REGEN BIOPHARMA INC PFD SER A 
RGCO,RGC RESOURCES INC
RGDFF,Reunion Gold Corporation Ordin
RGEN,REPLIGEN CORP
RGGI,RESGREEN GROUP INTERNATIONAL I
RGI,INVESCO S&P 500 EQUAL WEIGHT I
RGLD,ROYAL GOLD INC
RGLS,REGULUS THERAPEUTICS INC COM S
RGLSF,REGULUS RES INC NEW
RGNX,REGENXBIO INC COM
RGP,RESOURCES CONNECTION INC
RGR,STURM RUGER & CO INC
RGRX,REGENERX BIOPHARMACEUTICALS
RGS,REGIS CORP-MN-
RGT,ROYCE GLOBAL VALUE TR INC COM 
RH,RH COM(DE)
RHCO,READEN HLDG CORP COM STK (NV) 
RHE,REGIONAL HEALTH PPTYS INC COM 
RHEPRA,REGIONAL HEALTH PPTYS INC CUM 
RHHBY,ROCHE HLDG LTD SPONS ADR
RHI,ROBERT HALF INTERNATIONAL INC 
RHNO,RHINO RESOURCE PARTN
RHP,"RYMAN HOSPITALITY PROPERTIES, "
RHS,INVESCO ETF TR S&P 500 EQUAL W
RHUHF,RICHELIEU HARDWARE LTD
RIBS,SOUTHERN CONCEPTS RESTAURANT G
RIBT,RICEBRAN TECHNOLOGIES COMMON S
RICE,RICE ACQUISITION CORP CL A COM
RICEU,RICE ACQUISITION CORP UNIT 1 C
RICEWS,RICE ACQUISITION CORP WT EXP
RICOU,AGRICO ACQUISITION CORP UNIT 1
RICOY,RICOH LTD (NEW) ADR
RIDE,LORDSTOWN MTRS CORP COM CL A (
RIG,TRANSOCEAN LTD (SWITZERLAND)
RIGL,RIGEL PHARMACEUTICALS INC NEW 
RIGMF,RIDGESTONE MNG INC (CANADA)
RIGS,RIVERFRONT STRATEGIC INCOME FD
RIII,RENAVOTIO INC
RIINF,BRAVEHEART RESOURCES INC COMMO
RILY,"B. RILEY FINANCIAL, INC. COMMO"
RILYG,B RILEY FINL INC 7.25% SR NT D
RILYH,B RILEY FINL INC
RILYK,B RILEY FINL INC SR NT
RILYL,B RILEY FINL INC DEP SHS REPST
RILYN,B RILEY FINL INC 6.5% SR NT DU
RILYP,B RILEY FINL INC DEP SHS REP 1
RILYT,B RILEY FINL INC 6.00% SR NT D
RINF,PROSHARES TRUST INFLATION EXPE
RING,ISHARES INC MSCI GLOBAL GOLD M
RIO,RIO TINTO PLC ADS (4 ORD SHS) 
RIOCF,RIOCAN REAL ESTATE TRUST UT
RIOT,RIOT BLOCKCHAIN INC COM
RISN,NORTHERN LTS FD TR IV INSPIRE 
RIV,RIVERNORTH OPPORTUNITIES FD IN
RIVE,RIVERVIEW FINANCIAL CORP. COMM
RJA,SWEDISH EXPT CR CORP ELEMENTS 
RJF,RAYMOND JAMES FINANCIAL INC
RJI,SWEDISH EXPT CR CORP ELEMENTS 
RJKAF,RJK EXPLS LTD CL A SUB VTG NEW
RKDA,ARCADIA BIOSCIENCES INC COM NE
RKFL,ROCKETFUEL BLOCKCHAIN INC
RKT,"ROCKET COMPANIES, INC. (DE)"
RKTAU,ROCKET INTERNET GROWTH OPP COR
RKTAWS,ROCKET INTERNET GROWTH OPPORTU
RKUNY,"RAKUTEN GROUP, INC AMERICAN DE"
RL,RALPH LAUREN CORPORATION
RLAY,RELAY THERAPEUTICS INC
RLBD,"REAL BRANDS, INC."
RLGY,REALOGY HLDGS CORP COM STK (DE
RLI,RLI CORP
RLJ,RLJ LODGING TR COM
RLJPRA,RLJ LODGING TR CUM CONV PFD SE
RLMD,RELMADA THERAPEUTICS INC COM P
RLTR,REELTIME RENTALS INC
RLX,RLX TECHNOLOGY INC SPONSORED A
RLY,SSGA ACTIVE ETF TR
RLYGF,RILEY GOLD CORP (CANADA)
RM,REGIONAL MGMT CORP COM STK (DE
RMBI,RICHMOND MUT BANCORPORATION IN
RMBL,RUMBLEON INC
RMBS,RAMBUS INC (DE)
RMCF,ROCKY MTN CHOCOLATE FACTORY IN
RMD,RESMED INC
RMED,RA MED SYS INC. COM
RMGB,RMG ACQUISITION CORP II CL A (
RMGBW,RMG ACQUISITION CORP II WT EXP
RMGCW,RMG ACQUISITION CORP III (CYM)
RMHB,ROCKY MTN HIGH BRANDS INC COM 
RMI,RIVERNORTH OPPORTUNISTIC MUN
RMM,RIVERNORTH MANAGED DURATION MU
RMNI,RIMINI STR INC COM (DE)
RMO,"ROMEO POWER, INC CL A"
RMPLPR,RIVERNORTH SPECIALTY FINANCE C
RMRDF,RADISSON MINING RESOURCES INC 
RMRM,RMR MORTGAGE TRUST COM. STK
RMSL,REMSLEEP HLDGS INC COM NEW
RMT,ROYCE MICRO-CAP TRUST INC
RMTI,ROCKWELL MEDICAL INC COM STK (
RNA,AVIDITY BIOSCIENCES INC COM
RNAZ,TRANSCODE THERAPEUTICS INC COM
RNDB,RANDOLPH BANCORP INC COM
RNDM,FIRST TR VI DEVELOPED INTL EQU
RNDV,FIRST TR VI US EQUITY DIVID SE
RNECY,RENESAS ELECTRONICS CORP UNSPO
RNEM,FIRST TR VI EMERGING MKTS EQUI
RNG,RINGCENTRAL INC CL A (DE)
RNGR,RANGER ENERGY SVCS INC COM CL 
RNGTF,OSISKO DEV CORP COM(CANADA)
RNLC,FIRST TR VI LARGE CAP US EQUIT
RNLSY,RENAULT S.A. UNSPONSORED AMERI
RNLX,RENALYTIX AI PLC ADS (GBR)
RNMBY,Rheinmetall Ag Unsponsored ADR
RNMC,FIRST TR VI MID CAP US EQUITY 
RNP,COHEN & STEERS REIT AND PREFER
RNR,RENAISSANCERE HOLDINGS LTD
RNRG,GLBL X FUNDS GLBL X YLDCO & RE
RNRPRE,RENAISSANCERE HOLDGINGS LTD 5.
RNRPRF,RENAISSANCERE HLDGS (BERMUDA) 
RNRRP,RENAISSANCERE HOLDINGS LTD DEP
RNSC,FIRST TR VI SMALL CAP US EQUIT
RNWF,"Renewal Fuels, Inc. Common Sto"
RNWK,REALNETWORKS INC COM STK (WA) 
ROAD,CONSTRUCTION PARTNERS INC CL A
ROBO,ROBO GLOBAL ROBOTICS AND AUTOM
ROBT,FIRST TR EXCHANGE-TRADED FD VI
ROCC,ROTH CH ACQUISITION II CO COM 
ROCCW,ROTH CH ACQUISITION II CO WT E
ROCR,ROTH CH ACQUISITION III CO
ROCRW,ROTH CH ACQUISITION III CO WT 
RODE,LATTICE STRTGIES TR HARTFORD M
RODI,IPATH RETURN ON DISABILITY ETN
RODM,HARTFORD MULTIFACTOR DEVELOPED
ROG,ROGERS CORPORATION
ROHCY,Rohm Co Ltd Unsponsored ADR (J
ROIC,RETAIL OPPORTUNITY INVESTMENTS
ROIUF,ROUTE1 INC COM NEW (CAN)
ROK,ROCKWELL AUTOMATION INC.
ROKT,SPDR S&P KENSHO FINAL FRONTIER
ROKU,ROKU INC COM CL A
ROL,ROLLINS INC
ROLL,RBC BEARINGS INC
ROM,PROSHARES ULTRA TECHNOLOGY
ROMO,STRATEGY SHS NEWFOUND/RESOLVE 
ROOF,IQ U.S. REAL ESTATE SMALL CAP 
ROOT,ROOT INC CL A (DE)
ROP,ROPER TECHNOLOGIES INC COM STK
RORO,TIDAL ETF TR ATAC US ROTATION 
ROSC,HARTFORD MULTIFACTOR SMALL CAP
ROSN,ROSINBOMB COM (NV)
ROSS,ROSS ACQUISITION CORP II CL A 
ROSSWS,ROSS ACQUISITION CORP II WT EX
ROST,ROSS STORES INC
ROT,ROTOR ACQUISITION CORP
ROTU,ROTOR ACQUISITION CORP UNIT 1 
ROTWS,ROTOR ACQUISITION CORP WT EXP 
ROUS,HARTFORD MULTIFACTOR US EQUITY
RPAI,RETAIL PPTYS AMER INC CLASS A 
RPAR,TIDAL ETF TR RPAR RISK PARITY 
RPAY,REPAY HLDGS CORP CL A
RPD,RAPID7 INC COM STK (DE)
RPG,INVESCO EXCHANGE-TRADED FD TR 
RPHM,RENEO PHARMACEUTICALS INC COM 
RPMT,REGO PMT ARCHITECTUR
RPRX,ROYALTY PHARMA PLC SHS CL A (G
RPTX,REPARE THERAPEUTICS INC (CAN) 
RPV,INVESCO EXCHANGE-TRADED FD TR 
RQI,COHEN&STEERS QUALITY INC RLTY 
RRBI,RED RIV BANCSHARES INC COM
RRC,RANGE RESOURCES CORP
RRD,DONNELLEY R R & SONS CO COM ST
RRGB,RED ROBIN GOURMET BURGERS INC 
RRR,RED ROCK RESORTS INC CL A (DE)
RRRLF,ROCKRIDGE RES LTD COM(CANADA) 
RRTS,ROADRUNNER TRANSN SYS INC COM 
RS,RELIANCE STEEL & ALUMINUM CO (
RSASF,RESAAS SVCS INC ORD SHS (CDA) 
RSAU,ROOSHINE INC COM NEW
RSCF,"REFLECT SCIENTIFIC, INC."
RSCZF,GLOBAL CARE CAP INC
RSG,REPUBLIC SERVICES INC
RSGUF,ROGERS SUGAR INC ORDINARY SHAR
RSHN,RUSHNET INC
RSHYY,RUSHYDRO PJSC SPONSORED ADR (R
RSI,RUSH STR INTERACTIVE INC
RSLS,RESHAPE LIFESCIENCES INC NEW C
RSNVF,REYNA SILVER CORP COM (CAN)
RSP,INVESCO S&P 500 EQUAL WEIGHT E
RSSFF,AFFINOR GROWERS INC ORD SHS (C
RSSS,"RESEARCH SOLUTIONS, INC. COMMO"
RSTAY,RIB SOFTWARE SE AMERICAN DEPOS
RSTN,RDE INC
RSTRF,RESTAURANT BRANDS INTL LTD PAR
RSVA,RODGERS SILICON VY ACQUISITION
RSVAU,RODGERS SILICON VY ACQUISIT CO
RSVAW,RODGERS SILICON VY ACQUISITION
RSX,VANECK VECTORS ETF TR RUSSIA E
RSXJ,VANECK VECTORS ETF TR RUSSIA S
RTAI,COLLABORATIVE INVT SER TR RARE
RTH,VANECK VECTORS ETF TR RETAIL E
RTLR,RATTLER MIDSTREAM LP COM (DE) 
RTM,INVESCO S&P 500 EQUAL WEIGHT M
RTMFF,RT MINERALS CORP COM NO PAR NE
RTOKY,RENTOKIL INITIAL PLC SPONS ADR
RTON,RIGHT ON BRANDS INC
RTP,REINVENT TECHNOLOGY PARTNERS
RTPWS,REINVENT TECHNOLOGY PARTNERS
RTPY,REINVENT TECHNOLOGY PARTNERS Y
RTPYW,REINVENT TECHNOLOGY PARTNERS Y
RTPZ,REINVENT TECHNOLOGY PARTNERS Z
RTPZWS,REINVENT TECHNOLOGY PARTNERS Z
RTX,RAYTHEON TECHNOLOGIES CORP (DE
RUBY,RUBIUS THERAPEUTICS INC COM (D
RUN,SUNRUN INC COM STK (DE)
RUPRF,RUPERT RES LTD
RUSHA,RUSH ENTERPRISES INC CL-A
RUSL,DIREXION SHS ETF TR DAILY RUSS
RUSMF,RUSSELL METALS INC
RVI,RETAIL VALUE INC COM
RVIV,REVIV3 PROCARE CO COM
RVLGF,REVIVAL GOLD INC COM (CAN)
RVLV,REVOLVE GROUP INC CL A
RVMD,REVOLUTION MEDICINES INC COM S
RVNC,REVANCE THERAPEUTICS INC COM S
RVNU,XTRACKERS MUNICIPAL INFRASTRUC
RVP,RETRACTABLE TECHNOLOGIES INC. 
RVPH,REVIVA PHARMACEUTICALS HLDGS C
RVPHW,REVIVA PHARMACEUTICALS HLDGS C
RVSDF,RIVERSIDE RES INC NE
RVT,ROYCE VALUE TRUST INC.
RVVQF,RAVENQUEST BIOMED INC COM (CAN
RVVTF,REVIVE THERAPEUTICS LTD COM (C
RVXCF,RESVERLOGIX CORP
RWBYF,RED WHITE & BLOOM BRANDS INC
RWCRF,RIWI CORP. ORDINARY SHARES (CA
RWEOY,R W E AG SPONS ADR
RWGV,DIREXION SHS ETF TR RUSSELL 10
RWJ,INVESCO EXCHANGE-TRADED FD TR 
RWK,INVESCO EXCHANGE-TRADED FD TR 
RWL,INVESCO EXCHANGE-TRADED FD TR 
RWLK,REWALK ROBOTICS LTD SHS NEW (I
RWM,PROSHARES SHORT RUSSELL2000
RWO,SPDR DOW JONES GLOBAL REAL EST
RWR,SPDR DOW JONES REIT ETF
RWT,REDWOOD TST INC
RWX,SPDR DOW JONES INTERNATIONAL R
RXD,PROSHARES TR ULTRASHORT HEALTH
RXDX,PROMETHEUS BIOSCIENCES INC COM
RXI,ISHARES TR
RXL,PROSHARES ULTRA HEALTH CARE
RXMD,PROGRESSIVE CARE INC COM STK (
RXN,REXNORD CORP NEW COM STK (DE) 
RXRX,RECURSION PHARMACEUTICALS INC 
RXT,RACKSPACE TECHNOLOGY INC
RY,ROYAL BANK OF CANADA
RYAAY,RYANAIR HOLDINGS PLC SPONSORED
RYAM,RAYONIER ADVANCED MATLS INC CO
RYB,RYB ED INC ADR (CYM)
RYCEY,ROLLS ROYCE HLDNGS PLC SPONS A
RYE,INVESCO EXCHANGE-TRADED FD TR 
RYES,RISE GOLD CORP COM NEW (NV)
RYF,INVESCO S&P 500 EQUAL WEIGHT F
RYH,INVESCO S&P 500 EQUAL WEIGHT H
RYI,RYERSON HLDG CORP COM STK (DE)
RYJ,INVESCO EXCHANGE-TRADED FD TR 
RYKKY,RYOHIN KEIKAKU CO LTD (JPN) UN
RYLD,GLOBAL X FDS RUSSELL 2000 COVE
RYMDF,RELAY MED CORP (CANADA)
RYN,RAYONIER INC (REIT)
RYPPF,RYU APPAREL INC (CANADA)
RYT,INVESCO S&P 500 EQUAL WEIGHT T
RYTTF,ROYALTY NORTH PARTNERS LTD COM
RYU,INVESCO S&P 500 EQUAL WEIGHT U
RZA,REINSURANCE GRP OF AMER INC 6.
RZB,REINSURANCE GROUP AMER INC SUB
RZG,INVESCO FD TR S&P SMALLCAP 600
RZLT,REZOLUTE INC COM NEW (NV)
RZV,INVESCO FD TR
S,SENTINELONE INC CL A COM (DE) 
SA,SEABRIDGE GOLD INC
SAA,PROSHARES ULTRA SMALLCAP600
SABR,SABRE CORPORATION COMMON STOCK
SACC,SACHEM CAP CORP NT DTD 11/07/1
SACH,SACHEM CAP CORP COM
SACHPRA,SACHEM CAP CORP PFD SER A WI
SAENF,SOLAR ALLIANCE ENERGY INC NEW 
SAEYY,SHOP APOTHEKE EUROPE NV ADR (N
SAFE,SAFEHOLD INC COM
SAFM,SANDERSON FARMS INC
SAFRY,SAFRAN S A SPONSORED ADR (FRAN
SAGE,SAGE THERAPEUTICS INC COM
SAH,SONIC AUTOMOTIVE INC CL A
SAIC,SCIENCE APPLICATIONS INTL CORP
SAII,SOFTWARE ACQUISITION GROUP INC
SAIIW,SOFTWARE ACQUISITION GROUP INC
SAIL,SAILPOINT TECHNOLOGIES HLDGS
SAK,SARATOGA INVESTMENT CORP. NT 7
SAL,SALISBURY BANCORP INC(NEW)
SALM,SALEM MEDIA GROUP INC CL A COM
SALRY,SALMAR ASA ADR (NORWAY)
SAMG,SILVERCREST ASSET MGMT GROUP C
SAN,BANCO SANTANDER SA
SANA,SANA BIOTECHNOLOGY INC COM
SAND,SANDSTORM GOLD LTD. ORDINARY S
SANM,SANMINA CORP COM STK (DE)
SANW,S&W SEED CO COM STK (NV)
SAP,SAP SE ADS (EA REPSTG 1 COM SH
SAR,SARATOGA INVESTMENT CORP COM N
SARSF,CANADA HSE WELLNESS GROUP INC 
SASR,SANDY SPRING BANCORP INC
SAUHY,Straumann Holding Ag Unsponsor
SAVA,CASSAVA SCIENCES INC COM (DE) 
SAVE,SPIRIT AIRLS INC COM
SAXPY,Sampo OYJ Unsponsored ADR repr
SAYFF,3 SIXTY RISK SOLUTIO (CANADA) 
SB,SAFE BULKERS INC COM STK (MH) 
SBAC,SBA COMMUNICATIONS CORP NEW CL
SBBA,SCORPIO TANKERS INC. SR NT
SBBP,STRONGBRIDGE BIOPHARMA PLC SHS
SBEA,SILVERBOX ENGAGED MERGER CORP 
SBES,SOUTH BEACH SPIRITS
